"TÍTULO","AUTORES","FECHA","INDENTIFICADOR","OPENACCESS","TIPO","TIPO DE PRODUCCIÓN","CATEGORÍAS","FUENTE","IF SJR","CITAS EUROPEPMC","CITAS INSPIRE","CITAS SCHOLAR","Q SJR","CITACIÓN","PIDs"
"DISEÑO Y ANALISIS DE ALGORITMOS","Pérez Peló, Sergio","2020-09-01","2118033-2118","-","Docencia Impartida","Docencia Oficial Nacional","-","-","-","-","-","-","-","Pérez Peló, Sergio (2020). DISEÑO Y ANALISIS DE ALGORITMOS. Universdiad Rey Juan Carlos","2020-21_2118_2118033_sergio.perez.pelo (Universidad Rey Juan Carlos)"
"SEGURIDAD INFORMATICA","Pérez Peló, Sergio","2020-09-01","2118043-2118","-","Docencia Impartida","Docencia Oficial Nacional","-","-","-","-","-","-","-","Pérez Peló, Sergio (2020). SEGURIDAD INFORMATICA. Universdiad Rey Juan Carlos","2020-21_2118_2118043_sergio.perez.pelo (Universidad Rey Juan Carlos)"
"DISEÑO Y ANALISIS DE ALGORITMOS","Pérez Peló, Sergio","2020-09-01","2316031-2316","-","Docencia Impartida","Docencia Oficial Nacional","-","-","-","-","-","-","-","Pérez Peló, Sergio (2020). DISEÑO Y ANALISIS DE ALGORITMOS. Universdiad Rey Juan Carlos","2020-21_2316_2316031_sergio.perez.pelo (Universidad Rey Juan Carlos)"
"ESTRUCTURAS DE DATOS AVANZADAS","Pérez Peló, Sergio","2020-09-01","2315036-2315","-","Docencia Impartida","Docencia Oficial Nacional","-","-","-","-","-","-","-","Pérez Peló, Sergio (2020). ESTRUCTURAS DE DATOS AVANZADAS. Universdiad Rey Juan Carlos","2020-21_2315_2315036_sergio.perez.pelo (Universidad Rey Juan Carlos)"
"DISEÑO Y ANALISIS DE ALGORITMOS","Pérez Peló, Sergio","2020-09-01","2114019-2114","-","Docencia Impartida","Docencia Oficial Nacional","-","-","-","-","-","-","-","Pérez Peló, Sergio (2020). DISEÑO Y ANALISIS DE ALGORITMOS. Universdiad Rey Juan Carlos","2020-21_2114_2114019_sergio.perez.pelo (Universidad Rey Juan Carlos)"
"ESTRUCTURAS DE DATOS AVANZADAS","Pérez Peló, Sergio","2020-09-01","2033024-2033","-","Docencia Impartida","Docencia Oficial Nacional","-","-","-","-","-","-","-","Pérez Peló, Sergio (2020). ESTRUCTURAS DE DATOS AVANZADAS. Universdiad Rey Juan Carlos","2020-21_2033_2033024_sergio.perez.pelo (Universidad Rey Juan Carlos)"
"ESTRUCTURAS DE DATOS AVANZADAS","Pérez Peló, Sergio","2020-09-01","2113035-2113","-","Docencia Impartida","Docencia Oficial Nacional","-","-","-","-","-","-","-","Pérez Peló, Sergio (2020). ESTRUCTURAS DE DATOS AVANZADAS. Universdiad Rey Juan Carlos","2020-21_2113_2113035_sergio.perez.pelo (Universidad Rey Juan Carlos)"
"SISTEMAS DE INFORMACION","Pérez Peló, Sergio","2020-09-01","2285030-2285","-","Docencia Impartida","Docencia Oficial Nacional","-","-","-","-","-","-","-","Pérez Peló, Sergio (2020). SISTEMAS DE INFORMACION. Universdiad Rey Juan Carlos","2020-21_2285_2285030_sergio.perez.pelo (Universidad Rey Juan Carlos)"
"ESTRUCTURAS DE DATOS AVANZADAS","Pérez Peló, Sergio","2020-09-01","2097045-2097","-","Docencia Impartida","Docencia Oficial Nacional","-","-","-","-","-","-","-","Pérez Peló, Sergio (2020). ESTRUCTURAS DE DATOS AVANZADAS. Universdiad Rey Juan Carlos","2020-21_2097_2097045_sergio.perez.pelo (Universidad Rey Juan Carlos)"
"SOFT COMPUTING","Pérez Peló, Sergio","2020-09-01","620609-6206","-","Docencia Impartida","Docencia Oficial Nacional","-","-","-","-","-","-","-","Pérez Peló, Sergio (2020). SOFT COMPUTING. Universdiad Rey Juan Carlos","2020-21_6206_620609_sergio.perez.pelo (Universidad Rey Juan Carlos)"
"GENERADOR DE REPOSITORIO DE COMANDOS CON UN ARCHIVO DESCRIPTOR XML","Sánchez-Oro Calvo, Jesús (Tutor); Pérez Peló, Sergio (Cotutor)","2020-06-26","-","-","Dirección de Tesis, TFG, TFM, etc.","TFG","-","-","-","-","-","-","-","Sánchez-Oro Calvo, Jesús (Tutor); Pérez Peló, Sergio (Cotutor) (2020). GENERADOR DE REPOSITORIO DE COMANDOS CON UN ARCHIVO DESCRIPTOR XML. Universidad Rey Juan Carlos","TFG_2113043_jose.hernandez_316c95789f1c19c413515b5110812fa5 (Universidad Rey Juan Carlos)"
"DETECCIÓN DE URLS MALICIOSAS CON APRENDIZAJE AUTOMÁTICO","Sánchez-Oro Calvo, Jesús (Tutor); Pérez Peló, Sergio (Cotutor)","2020-06-26","-","-","Dirección de Tesis, TFG, TFM, etc.","TFG","-","-","-","-","-","-","-","Sánchez-Oro Calvo, Jesús (Tutor); Pérez Peló, Sergio (Cotutor) (2020). DETECCIÓN DE URLS MALICIOSAS CON APRENDIZAJE AUTOMÁTICO. Universidad Rey Juan Carlos","TFG_2113042_jose.hernandez_59f9c6b54978f2119bcd727cbfd39b6f (Universidad Rey Juan Carlos)"
"DISEÑO E IMPLEMENTACIÓN DE UNA APLICACIÓN EN LA NUBE PARA LA PREVENCIÓN DE LA INFECCIÓN DE DISPOSITIVOS","Sánchez-Oro Calvo, Jesús (Tutor); Pérez Peló, Sergio (Cotutor)","2020-06-03","-","-","Dirección de Tesis, TFG, TFM, etc.","TFG","-","-","-","-","-","-","-","Sánchez-Oro Calvo, Jesús (Tutor); Pérez Peló, Sergio (Cotutor) (2020). DISEÑO E IMPLEMENTACIÓN DE UNA APLICACIÓN EN LA NUBE PARA LA PREVENCIÓN DE LA INFECCIÓN DE DISPOSITIVOS. Universidad Rey Juan Carlos","TFG_2113042_j.prietogo_713eb266c43066cc7264601610ead17e (Universidad Rey Juan Carlos)"
"PREVENCIÓN DE LA INFECCIÓN DE DISPOSITIVOS MEDIANTE EL USO DE TÉCNICAS DE INTELIGENCIA ARTIFICIAL","Sánchez-Oro Calvo, Jesús (Tutor); Pérez Peló, Sergio (Cotutor)","2020-06-03","-","-","Dirección de Tesis, TFG, TFM, etc.","TFG","-","-","-","-","-","-","-","Sánchez-Oro Calvo, Jesús (Tutor); Pérez Peló, Sergio (Cotutor) (2020). PREVENCIÓN DE LA INFECCIÓN DE DISPOSITIVOS MEDIANTE EL USO DE TÉCNICAS DE INTELIGENCIA ARTIFICIAL. Universidad Rey Juan Carlos","TFG_2113043_j.prietogo_3a3a4e66e776b44f9aef0b8f5eda82c9 (Universidad Rey Juan Carlos)"
"Mejoras y correcciones de un algoritmo de optimización para la localización de placas solares","Lozano Osorio, Isaac (Investigador/a); Sánchez-Oro Calvo, Jesús (Investigador/a); Pérez Peló, Sergio (Investigador principal (IP)); Duarte Muñoz, Abraham (Investigador principal (IP))","2019-12-10","-","-","Proyectos I+D+I  y Ayudas","Proyecto Competitivo","-","-","-","-","-","-","-","Mejoras y correcciones de un algoritmo de optimización para la localización de placas solares. Lozano Osorio, Isaac (Investigador/a); Sánchez-Oro Calvo, Jesús (Investigador/a); Pérez Peló, Sergio (Investigador principal (IP)); Duarte Muñoz, Abraham (Investigador principal (IP)).  Financiadora: RATED POWER S.L.  (2019-12-10 / 2020-03-09)","M2189 (Otros);M2189 (Universidad Rey Juan Carlos)"
"A Multi-Objective Parallel Iterated Greedy for Solving the p-Center and p-Dispersion Problem","Pérez-Peló, S; Sánchez-Oro, J; López-Sánchez, AD; Duarte, A","2019-12-01","10.3390/electronics8121440","Y","Publicaciones","Artículo","Computer networks and communications; Computer science, information systems; Control and systems engineering; Electrical and electronic engineering; Engenharias iv; Engineering, electrical & electronic; Hardware and architecture; Physics, applied; Signal processing","Electronics","0.303","-","-","-","Q2","Pérez-Peló, S; Sánchez-Oro, J; López-Sánchez, AD; Duarte, A (2019). A Multi-Objective Parallel Iterated Greedy for Solving the p-Center and p-Dispersion Problem. Electronics, 8(12), 1440-. DOI: 10.3390/electronics8121440","10.3390/electronics8121440 (Crossref);2-s2.0-85076093881 (Scopus);WOS:000506678200067 (WoS)"
"Programación orientada a Ciencia de Datos","Pérez Peló, Sergio","2019-09-01","437623-4376","-","Docencia Impartida","Docencia Oficial Nacional","-","-","-","-","-","-","-","Pérez Peló, Sergio (2019). Programación orientada a Ciencia de Datos. Universdiad Rey Juan Carlos","2019-20_4376_437623_sergio.perez.pelo (Universidad Rey Juan Carlos)"
"DESARROLLO DE UNA PLATAFORMA DE GESTIÓN Y DIGITALIZACIÓN DE OBRAS FÍSICAS","Sánchez-Oro Calvo, Jesús (Tutor); Pérez Peló, Sergio (Cotutor)","2019-07-10","-","-","Dirección de Tesis, TFG, TFM, etc.","TFG","-","-","-","-","-","-","-","Sánchez-Oro Calvo, Jesús (Tutor); Pérez Peló, Sergio (Cotutor) (2019). DESARROLLO DE UNA PLATAFORMA DE GESTIÓN Y DIGITALIZACIÓN DE OBRAS FÍSICAS. Universidad Rey Juan Carlos","TFG_2034037_p.riverop_e054bdfb02379bb37d37d02501601687 (Universidad Rey Juan Carlos)"
"Desarrollo de un algoritmo de optimización para la localización de palacas solares","Sánchez-Oro Calvo, Jesús (Investigador/a); Pérez Peló, Sergio (Investigador principal (IP)); Duarte Muñoz, Abraham (Investigador principal (IP))","2019-02-22","-","-","Proyectos I+D+I  y Ayudas","Proyecto Competitivo","-","-","-","-","-","-","-","Desarrollo de un algoritmo de optimización para la localización de palacas solares. Sánchez-Oro Calvo, Jesús (Investigador/a); Pérez Peló, Sergio (Investigador principal (IP)); Duarte Muñoz, Abraham (Investigador principal (IP)).  Financiadora: RATED POWER S.L.  (2019-02-22 / 2019-10-20)","M2036 (Otros);M2036 (Universidad Rey Juan Carlos)"
"Detecting Weak Points in Networks Using Variable Neighborhood Search","Pérez-Peló S; Sánchez-Oro J; Duarte A","2019-01-01","10.1007/978-3-030-15843-9_12","N","Publicaciones","Conferencia Publicada","Administração pública e de empresas, ciências contábeis e turismo; Administração, ciências contábeis e turismo; Arquitetura e urbanismo; Arquitetura, urbanismo e design; Artes; Astronomia / física; Biodiversidade; Biotecnología; Ciência da computação; Ciências agrárias i; Ciências ambientais; Ciências biológicas i; Ciências biológicas ii; Ciências biológicas iii; Ciências sociais aplicadas i; Computer science (all); Computer science (miscellaneous); Computer science, artificial intelligence; Computer science, theory & methods; Comunicação e informação; Comunicació i informació; Direito; Educação; Educação física; Engenharias i; Engenharias ii; Engenharias iii; Engenharias iv; Ensino; Farmacia; General computer science; General o multidisciplinar; Geociências; Geografía; Interdisciplinar; Linguística e literatura; Matemática / probabilidade e estatística; Materiais; Medicina i; Medicina ii; Medicina iii; Medicina veterinaria; Odontología; Planejamento urbano e regional / demografia; Psicología; Química; Saúde coletiva; Theoretical computer science","Lecture Notes In Computer Science","0.427","-","-","-","Q2","Pérez-Peló S; Sánchez-Oro J; Duarte A (2019). Detecting Weak Points in Networks Using Variable Neighborhood Search. Berlin Heidelberg: Springer Verlag","10.1007/978-3-030-15843-9_12 (Crossref);2-s2.0-85064052121 (Scopus)"
"On the Analysis of the Influence of the Evaluation Metric in Community Detection over Social Networks","Pérez-Peló, S; Sánchez-Oro, J; Martín-Santamaría, R; Duarte, A","2019-01-01","10.3390/electronics8010023","Y","Publicaciones","Artículo","Computer networks and communications; Computer science, information systems; Control and systems engineering; Electrical and electronic engineering; Engenharias iv; Engineering, electrical & electronic; Hardware and architecture; Physics, applied; Signal processing","Electronics","0.303","-","-","-","Q2","Pérez-Peló, S; Sánchez-Oro, J; Martín-Santamaría, R; Duarte, A (2019). On the Analysis of the Influence of the Evaluation Metric in Community Detection over Social Networks. Electronics, 8(1), 23-. DOI: 10.3390/electronics8010023","10.3390/electronics8010023 (Crossref);2-s2.0-85059485892 (Scopus);WOS:000457142800023 (WoS)"
"Cybersecurity, Network Analysisis and Monitoring for the Next Generation Internet","Panizo Lledot, Ángel (Investigador/a); Quintana Pérez, Juan David (Investigador/a); Hernández Silva, Alfonso (Investigador/a); Herrán González, Alberto (Investigador/a); García Pardo, Eduardo (Investigador/a); Lozano Osorio, Isaac (Investigador/a); Martín Santamaría, Raúl (Investigador/a); Colmenar Verdugo, José Manuel (Investigador/a); Sánchez-Oro Calvo, Jesús (Investigador/a); Cavero Díaz, Sergio (Investigador/a); Pérez Peló, Sergio (Investigador/a); Rodríguez García, Miguel Ángel (Investigador/a); Rodríguez Uribe, Nicolás (Investigador/a); González Pardo, Antonio (Investigador/a); Duarte Muñoz, Abraham (Investigador principal (IP)); Yuste Moure, Javier (Investigador/a)","2019-01-01","S2018/TCS-4566","-","Proyectos I+D+I  y Ayudas","Proyecto Competitivo","-","-","-","-","-","-","-","Ref.:S2018/TCS-4566. Cybersecurity, Network Analysisis and Monitoring for the Next Generation Internet. Panizo Lledot, Ángel (Investigador/a); Quintana Pérez, Juan David (Investigador/a); Hernández Silva, Alfonso (Investigador/a); Herrán González, Alberto (Investigador/a); García Pardo, Eduardo (Investigador/a); Lozano Osorio, Isaac (Investigador/a); Martín Santamaría, Raúl (Investigador/a); Colmenar Verdugo, José Manuel (Investigador/a); Sánchez-Oro Calvo, Jesús (Investigador/a); Cavero Díaz, Sergio (Investigador/a); Pérez Peló, Sergio (Investigador/a); Rodríguez García, Miguel Ángel (Investigador/a); Rodríguez Uribe, Nicolás (Investigador/a); González Pardo, Antonio (Investigador/a); Duarte Muñoz, Abraham (Investigador principal (IP)); Yuste Moure, Javier (Investigador/a).  Financiadora: Comunidad de Madrid  (2019-01-01 / 2023-04-30)","M1959 (Otros);M1959 (Universidad Rey Juan Carlos)"
"Metaheurísticas eficientes para la optimización en grafos","Pérez Peló, Sergio (Investigador/a); Serrano Luján, Lucía (Investigador/a); Rodríguez García, Miguel Ángel (Investigador/a); Rodríguez Uribe, Nicolás (Investigador/a); Duarte Muñoz, Abraham (Investigador principal (IP)); Fernández Timón, Alfonso (Investigador/a); Yuste Moure, Javier (Investigador/a); Quintana Pérez, Juan David (Investigador/a); Herrán González, Alberto (Investigador/a); García Pardo, Eduardo (Investigador/a); Lozano Osorio, Isaac (Investigador/a); Martín Santamaría, Raúl (Investigador/a); Colmenar Verdugo, José Manuel (Investigador principal (IP)); Sánchez-Oro Calvo, Jesús (Investigador/a); Cavero Díaz, Sergio (Investigador/a)","2019-01-01","PGC2018-095322-B-C22","-","Proyectos I+D+I  y Ayudas","Proyecto Competitivo","-","-","-","-","-","-","-","Ref.:PGC2018-095322-B-C22. Metaheurísticas eficientes para la optimización en grafos
 . Pérez Peló, Sergio (Investigador/a); Serrano Luján, Lucía (Investigador/a); Rodríguez García, Miguel Ángel (Investigador/a); Rodríguez Uribe, Nicolás (Investigador/a); Duarte Muñoz, Abraham (Investigador principal (IP)); Fernández Timón, Alfonso (Investigador/a); Yuste Moure, Javier (Investigador/a); Quintana Pérez, Juan David (Investigador/a); Herrán González, Alberto (Investigador/a); García Pardo, Eduardo (Investigador/a); Lozano Osorio, Isaac (Investigador/a); Martín Santamaría, Raúl (Investigador/a); Colmenar Verdugo, José Manuel (Investigador principal (IP)); Sánchez-Oro Calvo, Jesús (Investigador/a); Cavero Díaz, Sergio (Investigador/a).  Financiadora: MINISTERIO DE ASUNTOS ECONOMICOS Y TRANSFORMACION DIGITAL  (2019-01-01 / 2022-09-30)","M2019 (Otros);M2019 (Universidad Rey Juan Carlos)"
"ESTUDIO DE DEBILIDADES EN REDES POR MEDIO DE UNA ESTRATEGIA HEURÍSTICA GRASP PARA EL PROBLEMA DE LOS SEPARADORES-ALFA","Sánchez-Oro Calvo, Jesús (Tutor); Pérez Peló, Sergio (Cotutor)","2018-08-29","-","-","Dirección de Tesis, TFG, TFM, etc.","TFG","-","-","-","-","-","-","-","Sánchez-Oro Calvo, Jesús (Tutor); Pérez Peló, Sergio (Cotutor) (2018). ESTUDIO DE DEBILIDADES EN REDES POR MEDIO DE UNA ESTRATEGIA HEURÍSTICA GRASP PARA EL PROBLEMA DE LOS SEPARADORES-ALFA. Universidad Rey Juan Carlos","TFG_2061037_jl.baonza_4d2ac4b5f0793f6f5bdc18d2cddf2ccb (Universidad Rey Juan Carlos)"
"Análisis de puntos débiles en redes utilizando metaheurísticas","Sánchez-Oro Calvo, Jesús (Tutor); Pérez Peló, Sergio (Cotutor)","2018-07-23","-","-","Dirección de Tesis, TFG, TFM, etc.","TFG","-","-","-","-","-","-","-","Sánchez-Oro Calvo, Jesús (Tutor); Pérez Peló, Sergio (Cotutor) (2018). Análisis de puntos débiles en redes utilizando metaheurísticas. Universidad Rey Juan Carlos","TFG_2114043_e.alfageme_4e540ba89c55698a0811d52a4cd0f6e7 (Universidad Rey Juan Carlos)"
"Desarrollo de un algoritmo de planificación y optimización de horarios","García Galán, Enrique (Investigador/a); Sánchez-Oro Calvo, Jesús (Investigador/a); Pérez Peló, Sergio (Investigador/a)","2018-05-01","-","-","Proyectos I+D+I  y Ayudas","Proyecto Competitivo","-","-","-","-","-","-","-","Desarrollo de un algoritmo de planificación y optimización de horarios. García Galán, Enrique (Investigador/a); Sánchez-Oro Calvo, Jesús (Investigador/a); Pérez Peló, Sergio (Investigador/a).  Financiadora: QOSLT Consulting  (2018-05-01 / 2018-07-31)","M1808 (Otros);M1808 (Universidad Rey Juan Carlos)"
"Detección de puntos débiles en redes utilizando GRASP y Path Relinking","Sergio Pérez Peló; Jesús Sánchez Oro; Abraham Duarte Muñoz","2018-01-01","-","-","Publicaciones","Capítulos de Libro","-","Xviii Conferencia De La Asociación Española Para La Inteligencia Artificial (Caepia 2018): Avances En Inteligencia Artificial. 23-26 De Octubre De 2018 Granada, España","-","-","-","-","-","Sergio Pérez Peló; Jesús Sánchez Oro; Abraham Duarte Muñoz (2018). Detección de puntos débiles en redes utilizando GRASP y Path Relinking. En . Xviii Conferencia De La Asociación Española Para La Inteligencia Artificial (Caepia 2018): Avances En Inteligencia Artificial. 23-26 De Octubre De 2018 Granada, España (pp. 531-536). : Asociacion Española para la Inteligencia Artificial (AEPIA)","7373849ARTLIB (Dialnet)"
"On the analysis of the influence of the evaluation metric in community detection using GRASP","Sergio Pérez Peló; Jesús Sánchez Oro; Abraham Duarte Muñoz","2018-01-01","-","-","Publicaciones","Capítulos de Libro","-","Xviii Conferencia De La Asociación Española Para La Inteligencia Artificial (Caepia 2018): Avances En Inteligencia Artificial. 23-26 De Octubre De 2018 Granada, España","-","-","-","-","-","Sergio Pérez Peló; Jesús Sánchez Oro; Abraham Duarte Muñoz (2018). On the analysis of the influence of the evaluation metric in community detection using GRASP. En . Xviii Conferencia De La Asociación Española Para La Inteligencia Artificial (Caepia 2018): Avances En Inteligencia Artificial. 23-26 De Octubre De 2018 Granada, España (pp. 981-986). : Asociacion Española para la Inteligencia Artificial (AEPIA)","7373938ARTLIB (Dialnet)"
"A Metaheuristic Approach for the alpha-separator Problem","Pérez-Peló, S; Sánchez-Oro, J; Duarte, A","2018-01-01","10.1007/978-3-030-03496-2_37","-","Publicaciones","Conferencia Publicada","Administração pública e de empresas, ciências contábeis e turismo; Administração, ciências contábeis e turismo; Arquitetura e urbanismo; Arquitetura, urbanismo e design; Artes; Astronomia / física; Biodiversidade; Biotecnología; Ciência da computação; Ciências agrárias i; Ciências ambientais; Ciências biológicas i; Ciências biológicas ii; Ciências biológicas iii; Ciências sociais aplicadas i; Computer science (all); Computer science (miscellaneous); Computer science, artificial intelligence; Computer science, theory & methods; Comunicação e informação; Comunicació i informació; Direito; Educação; Educação física; Engenharias i; Engenharias ii; Engenharias iii; Engenharias iv; Ensino; Farmacia; General computer science; General o multidisciplinar; Geociências; Geografía; Interdisciplinar; Linguística e literatura; Matemática / probabilidade e estatística; Materiais; Medicina i; Medicina ii; Medicina iii; Medicina veterinaria; Odontología; Planejamento urbano e regional / demografia; Psicología; Química; Saúde coletiva; Theoretical computer science","Lecture Notes In Computer Science","0.283","-","-","-","Q2","Pérez-Peló, S; Sánchez-Oro, J; Duarte, A (2018). A Metaheuristic Approach for the alpha-separator Problem. : Springer International Publishing AG","2-s2.0-85057093567 (Scopus);WOS:000582459900037 (WoS)"
"Nuevos enfoques metaheurísticos para resolver problemas de dominación","Duarte Muñoz, Abraham (Codirector) ; Sánchez-Oro Calvo, Jesús (Tutor) ; Pérez Peló, Sergio (Tutor) Doctorando: ALEJANDRA CASADO CEBALLOS","-","-","-","Dirección de Tesis, TFG, TFM, etc.","Tesis Doctoral","-","-","-","-","-","-","-","Duarte Muñoz, Abraham (Codirector) ; Sánchez-Oro Calvo, Jesús (Tutor) ; Pérez Peló, Sergio (Tutor) Doctorando: ALEJANDRA CASADO CEBALLOS (). Nuevos enfoques metaheurísticos para resolver problemas de dominación. Universdiad Rey Juan Carlos","-"