"TÍTULO","AUTORES","FECHA","INDENTIFICADOR","OPENACCESS","TIPO","TIPO DE PRODUCCIÓN","CATEGORÍAS","FUENTE","IF SJR","CITAS EUROPEPMC","CITAS INSPIRE","CITAS SCHOLAR","Q SJR","CITACIÓN","PIDs"
"Greedy Randomized Adaptive Search Procedures with Path Relinking. An analytical review of designs and implementations","Laguna, Manuel; Marti, Rafael; Martinez-Gavara, Anna; Perez-Pelo, Sergio; Resende, Mauricio G C","2025-09-03","10.1016/j.ejor.2025.02.022","N","Publicaciones","Review","Administração pública e de empresas, ciências contábeis e turismo; Administração, ciências contábeis e turismo; Biotecnología; Ciência da computação; Ciência política e relações internacionais; Ciências agrárias i; Ciências ambientais; Ciencias sociales; Computer science (all); Computer science (miscellaneous); Comunicación e información; Direito; Economia; Engenharias i; Engenharias ii; Engenharias iii; Engenharias iv; Farmacia; General computer science; Industrial and manufacturing engineering; Información y documentación; Information systems and management; Interdisciplinar; Management; Management science and operations research; Matemática / probabilidade e estatística; Medicina i; Modeling and simulation; Operations research & management science; Planejamento urbano e regional / demografia","European Journal Of Operational Research","2.239","-","-","-","Q1","Laguna, Manuel; Marti, Rafael; Martinez-Gavara, Anna; Perez-Pelo, Sergio; Resende, Mauricio G C (2025). Greedy Randomized Adaptive Search Procedures with Path Relinking. An analytical review of designs and implementations. European Journal Of Operational Research, 327(3), 717-734. DOI: 10.1016/j.ejor.2025.02.022","10300591 (iMarina);2-s2.0-86000145957 (Scopus);WOS:001566251500001 (WoS)"
"DISEÑO Y ANALISIS DE ALGORITMOS","Pérez Peló, Sergio","2025-09-01","2316031-2316","-","Docencia Impartida","Docencia Oficial Nacional","-","-","-","-","-","-","-","Pérez Peló, Sergio (2025). DISEÑO Y ANALISIS DE ALGORITMOS. Universdiad Rey Juan Carlos","2025-26_2316_2316031_sergio.perez.pelo (Universidad Rey Juan Carlos)"
"DISEÑO Y ANALISIS DE ALGORITMOS","Pérez Peló, Sergio","2025-09-01","2118033-2118","-","Docencia Impartida","Docencia Oficial Nacional","-","-","-","-","-","-","-","Pérez Peló, Sergio (2025). DISEÑO Y ANALISIS DE ALGORITMOS. Universdiad Rey Juan Carlos","2025-26_2118_2118033_sergio.perez.pelo (Universidad Rey Juan Carlos)"
"ALGORITMOS PARA JUEGOS","Pérez Peló, Sergio","2025-09-01","2321031-2321","-","Docencia Impartida","Docencia Oficial Nacional","-","-","-","-","-","-","-","Pérez Peló, Sergio (2025). ALGORITMOS PARA JUEGOS. Universdiad Rey Juan Carlos","2025-26_2321_2321031_sergio.perez.pelo (Universidad Rey Juan Carlos)"
"DISEÑO Y ANALISIS DE ALGORITMOS","Pérez Peló, Sergio","2025-09-01","2114019-2114","-","Docencia Impartida","Docencia Oficial Nacional","-","-","-","-","-","-","-","Pérez Peló, Sergio (2025). DISEÑO Y ANALISIS DE ALGORITMOS. Universdiad Rey Juan Carlos","2025-26_2114_2114019_sergio.perez.pelo (Universidad Rey Juan Carlos)"
"DISEÑO Y ANALISIS DE ALGORITMOS","Pérez Peló, Sergio","2025-09-01","2034019-2034","-","Docencia Impartida","Docencia Oficial Nacional","-","-","-","-","-","-","-","Pérez Peló, Sergio (2025). DISEÑO Y ANALISIS DE ALGORITMOS. Universdiad Rey Juan Carlos","2025-26_2034_2034019_sergio.perez.pelo (Universidad Rey Juan Carlos)"
"INTELIGENCIA ARTIFICIAL EN CIBERSEGURIDAD","Pérez Peló, Sergio","2025-09-01","2361038-2361","-","Docencia Impartida","Docencia Oficial Nacional","-","-","-","-","-","-","-","Pérez Peló, Sergio (2025). INTELIGENCIA ARTIFICIAL EN CIBERSEGURIDAD. Universdiad Rey Juan Carlos","2025-26_2361_2361038_sergio.perez.pelo (Universidad Rey Juan Carlos)"
"ALGORITMOS PARA JUEGOS","Pérez Peló, Sergio","2025-09-01","2175029-2175","-","Docencia Impartida","Docencia Oficial Nacional","-","-","-","-","-","-","-","Pérez Peló, Sergio (2025). ALGORITMOS PARA JUEGOS. Universdiad Rey Juan Carlos","2025-26_2175_2175029_sergio.perez.pelo (Universidad Rey Juan Carlos)"
"ALGORITMOS","Pérez Peló, Sergio","2025-09-01","2361011-2361","-","Docencia Impartida","Docencia Oficial Nacional","-","-","-","-","-","-","-","Pérez Peló, Sergio (2025). ALGORITMOS. Universdiad Rey Juan Carlos","2025-26_2361_2361011_sergio.perez.pelo (Universidad Rey Juan Carlos)"
"METODOLOGIAS DE DESARROLLO SEGURO","Pérez Peló, Sergio","2025-09-01","2285028-2285","-","Docencia Impartida","Docencia Oficial Nacional","-","-","-","-","-","-","-","Pérez Peló, Sergio (2025). METODOLOGIAS DE DESARROLLO SEGURO. Universdiad Rey Juan Carlos","2025-26_2285_2285028_sergio.perez.pelo (Universidad Rey Juan Carlos)"
"A multistart variable neighborhood descent metaheuristic for the board packing problem","Pérez-Peló S; Martínez-Gavara A; Sánchez-Oro J; López-Sánchez AD","2025-08-11","10.1007/s10479-025-06787-2","N","Publicaciones","Artículo pendiente de publicación","Administração pública e de empresas, ciências contábeis e turismo; Administração, ciências contábeis e turismo; Ciência da computação; Ciências agrárias i; Ciencias sociales; Decision sciences (all); Decision sciences (miscellaneous); Economia; Engenharias i; Engenharias iii; Engenharias iv; Ensino; General decision sciences; Interdisciplinar; Management science and operations research; Matemática / probabilidade e estatística; Medicina i; Operations research & management science; Saúde coletiva","Annals Of Operations Research","1.092","-","-","-","Q1","Pérez-Peló S; Martínez-Gavara A; Sánchez-Oro J; López-Sánchez AD (2025). A multistart variable neighborhood descent metaheuristic for the board packing problem. Annals Of Operations Research, 352(1-2), 193-216. DOI: 10.1007/s10479-025-06787-2","10383865 (iMarina);2-s2.0-105012941474 (Scopus);WOS:001546885200001 (WoS)"
"OPTIMIZACIÓN Y EVALUACIÓN DE MODELOS DE CLASIFICACIÓN PARA DETECCIÓN DE TRAMPAS EN VIDEOJUEGOS MULTIJUGADOR ONLINE","Sánchez-Oro Calvo, Jesús (Tutor); Pérez Peló, Sergio (Cotutor)","2025-07-23","-","-","Dirección de Tesis, TFG, TFM, etc.","TFG","-","-","-","-","-","-","-","Sánchez-Oro Calvo, Jesús (Tutor); Pérez Peló, Sergio (Cotutor) (2025). OPTIMIZACIÓN Y EVALUACIÓN DE MODELOS DE CLASIFICACIÓN PARA DETECCIÓN DE TRAMPAS EN VIDEOJUEGOS MULTIJUGADOR ONLINE.","-"
"DETECCIÓN Y PREVENCIÓN DE ATAQUES RANSOMWARE MEDIANTE EDRS DE CÓDIGO ABIERTO","Martín Santamaría, Raúl (Tutor); Pérez Peló, Sergio (Cotutor)","2025-07-16","-","-","Dirección de Tesis, TFG, TFM, etc.","TFG","-","-","-","-","-","-","-","Martín Santamaría, Raúl (Tutor); Pérez Peló, Sergio (Cotutor) (2025). DETECCIÓN Y PREVENCIÓN DE ATAQUES RANSOMWARE MEDIANTE EDRS DE CÓDIGO ABIERTO.","-"
"FUZZEND: DESARROLLO DE UN FUZZER MUTACIONAL CON COBERTURA DE CÓDIGO PARA VISORES DE PDF","Pérez Peló, Sergio (Tutor)","2025-07-16","-","-","Dirección de Tesis, TFG, TFM, etc.","TFG","-","-","-","-","-","-","-","Pérez Peló, Sergio (Tutor) (2025). FUZZEND: DESARROLLO DE UN FUZZER MUTACIONAL CON COBERTURA DE CÓDIGO PARA VISORES DE PDF.","-"
"INGENIERÍA SOCIAL Y PHISHING: EVOLUCIÓN CONCEPTUAL, TÉCNICAS Y DESAFÍOS.","Pérez Peló, Sergio (Tutor)","2025-07-05","-","-","Dirección de Tesis, TFG, TFM, etc.","TFG","-","-","-","-","-","-","-","Pérez Peló, Sergio (Tutor) (2025). INGENIERÍA SOCIAL Y PHISHING: EVOLUCIÓN CONCEPTUAL, TÉCNICAS Y DESAFÍOS..","-"
"OPTIMIZACIÓN DE RUTAS CON ALGORITMOS VORACES Y METAHEURÍSTICA GRASP","Pérez Peló, Sergio (Tutor)","2025-06-27","-","-","Dirección de Tesis, TFG, TFM, etc.","TFG","-","-","-","-","-","-","-","Pérez Peló, Sergio (Tutor) (2025). OPTIMIZACIÓN DE RUTAS CON ALGORITMOS VORACES Y METAHEURÍSTICA GRASP.","-"
"DESARROLLO DE LABORATORIO DE PRÁCTICA PARA TÉCNICAS DE PENTESTING","Pérez Peló, Sergio (Tutor)","2025-04-24","-","-","Dirección de Tesis, TFG, TFM, etc.","TFG","-","-","-","-","-","-","-","Pérez Peló, Sergio (Tutor) (2025). DESARROLLO DE LABORATORIO DE PRÁCTICA PARA TÉCNICAS DE PENTESTING.","-"
"A novel parallel framework for scatter search","Casado, A; Perez-Pelo, S; Sanchez-Oro, J; Duarte, A; Laguna, M","2025-04-08","10.1016/j.knosys.2025.113248","N","Publicaciones","Artículo","Administração pública e de empresas, ciências contábeis e turismo; Artificial intelligence; Astronomia / física; Ciência da computação; Ciências biológicas i; Ciencias sociales; Computer science, artificial intelligence; Comunicación e información; Economia; Engenharias iii; Engenharias iv; Información y documentación; Information systems and management; Interdisciplinar; Management information systems; Matemática / probabilidade e estatística; Software","Knowledge-Based Systems","1.934","-","-","-","Q1","Casado, A; Perez-Pelo, S; Sanchez-Oro, J; Duarte, A; Laguna, M (2025). A novel parallel framework for scatter search. Knowledge-Based Systems, 314(), 113248-. DOI: 10.1016/j.knosys.2025.113248","10.1016/j.knosys.2025.113248 (Crossref);10295105 (iMarina);2-s2.0-85219570767 (Scopus);WOS:001440604300001 (WoS)"
"PROBLEMA DEL ALFA VECINO P-CENTRO (ANPCP) APLICADO A LA RESILIENCIA EN INFRAESTRUCTURAS CRÍTICAS","Pérez Peló, Sergio (Tutor)","2025-03-03","-","-","Dirección de Tesis, TFG, TFM, etc.","TFG","-","-","-","-","-","-","-","Pérez Peló, Sergio (Tutor) (2025). PROBLEMA DEL ALFA VECINO P-CENTRO (ANPCP) APLICADO A LA RESILIENCIA EN INFRAESTRUCTURAS CRÍTICAS.","-"
"Búsqueda de vecindad variable para el board packing problem","Sergio Pérez Peló; Anna Martínez Gavara; Jesús Sánchez Oro Calvo","2025-01-01","-","-","Publicaciones","Capítulos de Libro","-","Actas Del Xvi Congreso Español De Metaheurísticas, Algoritmos Evolutivos Y Bioinspirados: (Maeb 2025) 28-30 De Mayo, Donostia/San Sebastián","-","-","-","-","-","Sergio Pérez Peló; Anna Martínez Gavara; Jesús Sánchez Oro Calvo (2025). Búsqueda de vecindad variable para el board packing problem. En . Actas Del Xvi Congreso Español De Metaheurísticas, Algoritmos Evolutivos Y Bioinspirados: (Maeb 2025) 28-30 De Mayo, Donostia/San Sebastián (pp. 250-260). : Universidad del País Vasco = Euskal Herriko Unibertsitatea, Servicio Editorial = Argitalpen Zerbitzua","10321707ARTLIB (Dialnet)"
"Ciberseguridad e inteligencia artificial resiliente para la Comunidad de Madrid. (GRAFO)","Serrano Luján, Lucía (Investigador/a); Penedo Ventosa, Iván (Investigador/a); Pérez Peló, Sergio (Investigador/a); Martín García, Lucas (Investigador/a); Cavero Díaz, Sergio (Investigador/a); Colmenar Verdugo, José Manuel (Investigador/a); Salazar Cárdenas, Sergio (Investigador/a); Martín Santamaría, Raúl (Investigador/a); Ventura Cabrejas, Silvia (Investigador/a); Lozano Osorio, Isaac (Investigador/a); García Pardo, Eduardo (Investigador/a); Herrán González, Alberto (Investigador/a); Casado Ceballos, Alejandra (Investigador/a); Diaconescu, Teodor Andrei (Investigador/a); Duarte Muñoz, Abraham (Investigador/a); Sánchez-Oro Calvo, Jesús (Investigador principal (IP)); Yuste Moure, Javier (Investigador/a); Fernández Timón, Alfonso (Investigador/a); González Pardo, Antonio (Investigador/a); Robles Rodríguez, Marcos (Investigador/a); Rodríguez Uribe, Nicolás (Investigador/a); Viejo Fernández, Manuel (Investigador/a)","2025-01-01","TEC-2024/COM-404","-","Proyectos I+D+I  y Ayudas","Proyecto Competitivo","","-","-","-","-","-","-","Ref.:TEC-2024/COM-404. Ciberseguridad e inteligencia artificial resiliente para la Comunidad de Madrid. (GRAFO). Serrano Luján, Lucía (Investigador/a); Penedo Ventosa, Iván (Investigador/a); Pérez Peló, Sergio (Investigador/a); Martín García, Lucas (Investigador/a); Cavero Díaz, Sergio (Investigador/a); Colmenar Verdugo, José Manuel (Investigador/a); Salazar Cárdenas, Sergio (Investigador/a); Martín Santamaría, Raúl (Investigador/a); Ventura Cabrejas, Silvia (Investigador/a); Lozano Osorio, Isaac (Investigador/a); García Pardo, Eduardo (Investigador/a); Herrán González, Alberto (Investigador/a); Casado Ceballos, Alejandra (Investigador/a); Diaconescu, Teodor Andrei (Investigador/a); Duarte Muñoz, Abraham (Investigador/a); Sánchez-Oro Calvo, Jesús (Investigador principal (IP)); Yuste Moure, Javier (Investigador/a); Fernández Timón, Alfonso (Investigador/a); González Pardo, Antonio (Investigador/a); Robles Rodríguez, Marcos (Investigador/a); Rodríguez Uribe, Nicolás (Investigador/a); Viejo Fernández, Manuel (Investigador/a).  Financiadora: Comunidad de Madrid  (2025-01-01 / 2028-12-31)","M3832 (Universidad Rey Juan Carlos)"
"Adquisición de equipamiento para Altas Capacidades Computación.","Concha Gómez, David (Investigador/a); Lozano Osorio, Isaac (Investigador/a); Martín Santamaría, Raúl (Investigador principal (IP)); Cavero Díaz, Sergio (Investigador/a); Pérez Peló, Sergio (Investigador/a); Aranda Barjola, Luis Alberto (Investigador/a); García Espinosa, Francisco José (Investigador/a); Rodríguez Uribe, Nicolás (Investigador/a); Maes Bermejo, Michel (Investigador/a); Moreno San Segundo, José Ángel (Investigador/a); Ramírez Díaz, Iván (Investigador/a); Hortelano Haro, Diego (Investigador/a); Yuste Moure, Javier (Investigador/a)","2025-01-01","2024/SOLCON-64631","-","Proyectos I+D+I  y Ayudas","Proyecto Competitivo","","-","-","-","-","-","-","Ref.:2024/SOLCON-64631. Adquisición de equipamiento para Altas Capacidades Computación.. Concha Gómez, David (Investigador/a); Lozano Osorio, Isaac (Investigador/a); Martín Santamaría, Raúl (Investigador principal (IP)); Cavero Díaz, Sergio (Investigador/a); Pérez Peló, Sergio (Investigador/a); Aranda Barjola, Luis Alberto (Investigador/a); García Espinosa, Francisco José (Investigador/a); Rodríguez Uribe, Nicolás (Investigador/a); Maes Bermejo, Michel (Investigador/a); Moreno San Segundo, José Ángel (Investigador/a); Ramírez Díaz, Iván (Investigador/a); Hortelano Haro, Diego (Investigador/a); Yuste Moure, Javier (Investigador/a).  Financiadora: Universidad Rey Juan Carlos  (2025-01-01 / 2025-12-31)","M3693 (Universidad Rey Juan Carlos)"
"CIPHERENGINE Fostering computational thinking via cryptographic methods for interdisciplinary STEAM education","González Pardo, Antonio (Investigador principal (IP)); Pérez Peló, Sergio (Investigador/a); Martín Santamaría, Raúl (Investigador/a); Lozano Osorio, Isaac (Investigador/a)","2024-12-31","2024-1-NL01-KA220-SCH-000248233","-","Proyectos I+D+I  y Ayudas","Proyecto Competitivo","","-","-","-","-","-","-","Ref.:2024-1-NL01-KA220-SCH-000248233. CIPHERENGINE Fostering computational thinking via cryptographic methods for interdisciplinary STEAM education. González Pardo, Antonio (Investigador principal (IP)); Pérez Peló, Sergio (Investigador/a); Martín Santamaría, Raúl (Investigador/a); Lozano Osorio, Isaac (Investigador/a).  Financiadora: European commision  (2024-12-31 / 2026-12-30)","M3740 (Universidad Rey Juan Carlos)"
"ANÁLISIS DEL ESTADO DEL ARTE DE EDR Y COMPARATIVA CON ANTIVIRUS TRADICIONALES","Pérez Peló, Sergio (Tutor)","2024-12-18","-","-","Dirección de Tesis, TFG, TFM, etc.","TFG","-","-","-","-","-","-","-","Pérez Peló, Sergio (Tutor) (2024). ANÁLISIS DEL ESTADO DEL ARTE DE EDR Y COMPARATIVA CON ANTIVIRUS TRADICIONALES.","-"
"TECNICAS DE HACKING","Pérez Peló, Sergio","2024-09-01","2285015-2285","-","Docencia Impartida","Docencia Oficial Nacional","-","-","-","-","-","-","-","Pérez Peló, Sergio (2024). TECNICAS DE HACKING. Universdiad Rey Juan Carlos","2024-25_2285_2285015_sergio.perez.pelo (Universidad Rey Juan Carlos)"
"ALGORITMOS PARA JUEGOS","Pérez Peló, Sergio","2024-09-01","2175029-2175","-","Docencia Impartida","Docencia Oficial Nacional","-","-","-","-","-","-","-","Pérez Peló, Sergio (2024). ALGORITMOS PARA JUEGOS. Universdiad Rey Juan Carlos","2024-25_2175_2175029_sergio.perez.pelo (Universidad Rey Juan Carlos)"
"ALGORITMOS PARA JUEGOS","Pérez Peló, Sergio","2024-09-01","2321031-2321","-","Docencia Impartida","Docencia Oficial Nacional","-","-","-","-","-","-","-","Pérez Peló, Sergio (2024). ALGORITMOS PARA JUEGOS. Universdiad Rey Juan Carlos","2024-25_2321_2321031_sergio.perez.pelo (Universidad Rey Juan Carlos)"
"DESARROLLO WEB SEGURO","Pérez Peló, Sergio","2024-09-01","2285017-2285","-","Docencia Impartida","Docencia Oficial Nacional","-","-","-","-","-","-","-","Pérez Peló, Sergio (2024). DESARROLLO WEB SEGURO. Universdiad Rey Juan Carlos","2024-25_2285_2285017_sergio.perez.pelo (Universidad Rey Juan Carlos)"
"ESTRUCTURAS DE DATOS","Pérez Peló, Sergio","2024-09-01","2285010-2285","-","Docencia Impartida","Docencia Oficial Nacional","-","-","-","-","-","-","-","Pérez Peló, Sergio (2024). ESTRUCTURAS DE DATOS. Universdiad Rey Juan Carlos","2024-25_2285_2285010_sergio.perez.pelo (Universidad Rey Juan Carlos)"
"ALGORITMOS","Pérez Peló, Sergio","2024-09-01","2361011-2361","-","Docencia Impartida","Docencia Oficial Nacional","-","-","-","-","-","-","-","Pérez Peló, Sergio (2024). ALGORITMOS. Universdiad Rey Juan Carlos","2024-25_2361_2361011_sergio.perez.pelo (Universidad Rey Juan Carlos)"
"PENTESTING","Pérez Peló, Sergio","2024-09-01","2285034-2285","-","Docencia Impartida","Docencia Oficial Nacional","-","-","-","-","-","-","-","Pérez Peló, Sergio (2024). PENTESTING. Universdiad Rey Juan Carlos","2024-25_2285_2285034_sergio.perez.pelo (Universidad Rey Juan Carlos)"
"MALWARE Y AMENAZAS DIRIGIDAS","Pérez Peló, Sergio","2024-09-01","2285027-2285","-","Docencia Impartida","Docencia Oficial Nacional","-","-","-","-","-","-","-","Pérez Peló, Sergio (2024). MALWARE Y AMENAZAS DIRIGIDAS. Universdiad Rey Juan Carlos","2024-25_2285_2285027_sergio.perez.pelo (Universidad Rey Juan Carlos)"
"INTRODUCCION A LA CIBERSEGURIDAD","Pérez Peló, Sergio","2024-09-01","2285002-2285","-","Docencia Impartida","Docencia Oficial Nacional","-","-","-","-","-","-","-","Pérez Peló, Sergio (2024). INTRODUCCION A LA CIBERSEGURIDAD. Universdiad Rey Juan Carlos","2024-25_2285_2285002_sergio.perez.pelo (Universidad Rey Juan Carlos)"
"PROPUESTA METODOLÓGICA PARA LA EXPLOTACIÓN DE HIPERVISORES: UN ENFOQUE PRÁCTICO","Pérez Peló, Sergio (Tutor)","2024-07-11","-","-","Dirección de Tesis, TFG, TFM, etc.","TFG","-","-","-","-","-","-","-","Pérez Peló, Sergio (Tutor) (2024). PROPUESTA METODOLÓGICA PARA LA EXPLOTACIÓN DE HIPERVISORES: UN ENFOQUE PRÁCTICO.","-"
"PROPUESTA METODOLÓGICA PARA LA EXPLOTACIÓN DE HIPERVISORES: UN ENFOQUE PRÁCTICO","Pérez Peló, Sergio (Tutor)","2024-07-05","-","-","Dirección de Tesis, TFG, TFM, etc.","TFG","-","-","-","-","-","-","-","Pérez Peló, Sergio (Tutor) (2024). PROPUESTA METODOLÓGICA PARA LA EXPLOTACIÓN DE HIPERVISORES: UN ENFOQUE PRÁCTICO.","-"
"A Biased Random Key Genetic Algorithm for Solving the α-Neighbor p-Center Problem","Pérez-Peló, S; Sánchez-Oro, J; Duarte, A","2024-01-01","10.1007/978-3-031-62912-9_2","-","Publicaciones","Conferencia Publicada","Administração pública e de empresas, ciências contábeis e turismo; Administração, ciências contábeis e turismo; Arquitetura e urbanismo; Arquitetura, urbanismo e design; Artes; Astronomia / física; Biodiversidade; Biotecnología; Ciência da computação; Ciências agrárias i; Ciências ambientais; Ciências biológicas i; Ciências biológicas ii; Ciências biológicas iii; Ciências sociais aplicadas i; Computer science (all); Computer science (miscellaneous); Computer science, artificial intelligence; Computer science, theory & methods; Comunicação e informação; Comunicació i informació; Direito; Educação; Educação física; Engenharias i; Engenharias ii; Engenharias iii; Engenharias iv; Ensino; Farmacia; General computer science; General o multidisciplinar; Geociências; Geografía; Interdisciplinar; Linguística e literatura; Matemática / probabilidade e estatística; Materiais; Medicina i; Medicina ii; Medicina iii; Medicina veterinaria; Odontología; Planejamento urbano e regional / demografia; Psicología; Química; Saúde coletiva; Theoretical computer science","Lecture Notes In Computer Science","0.352","-","-","-","Q2","Pérez-Peló, S; Sánchez-Oro, J; Duarte, A (2024). A Biased Random Key Genetic Algorithm for Solving the α-Neighbor p-Center Problem. : Springer International Publishing AG","10.1007/978-3-031-62912-9_2 (Crossref);2-s2.0-85198035277 (Scopus);WOS:001282251200038 (WoS)"
"Tramo de Investigación (Sexenio)","Pérez Peló, Sergio","2023-12-31","-","-","Reconocimientos","Tramo de Investigación (Sexenio)","-","-","-","-","-","-","-","Tramo de Investigación (Sexenio) (2023)","sergio.perez.pelo-sexenios (Universidad Rey Juan Carlos)"
"ALGORITMOS","Pérez Peló, Sergio","2023-09-01","2361011-2361","-","Docencia Impartida","Docencia Oficial Nacional","-","-","-","-","-","-","-","Pérez Peló, Sergio (2023). ALGORITMOS. Universdiad Rey Juan Carlos","2023-24_2361_2361011_sergio.perez.pelo (Universidad Rey Juan Carlos)"
"DISEÑO Y ANALISIS DE ALGORITMOS","Pérez Peló, Sergio","2023-09-01","2285022-2285","-","Docencia Impartida","Docencia Oficial Nacional","-","-","-","-","-","-","-","Pérez Peló, Sergio (2023). DISEÑO Y ANALISIS DE ALGORITMOS. Universdiad Rey Juan Carlos","2023-24_2285_2285022_sergio.perez.pelo (Universidad Rey Juan Carlos)"
"ESTRUCTURAS DE DATOS","Pérez Peló, Sergio","2023-09-01","2285010-2285","-","Docencia Impartida","Docencia Oficial Nacional","-","-","-","-","-","-","-","Pérez Peló, Sergio (2023). ESTRUCTURAS DE DATOS. Universdiad Rey Juan Carlos","2023-24_2285_2285010_sergio.perez.pelo (Universidad Rey Juan Carlos)"
"DESARROLLO WEB SEGURO","Pérez Peló, Sergio","2023-09-01","2285017-2285","-","Docencia Impartida","Docencia Oficial Nacional","-","-","-","-","-","-","-","Pérez Peló, Sergio (2023). DESARROLLO WEB SEGURO. Universdiad Rey Juan Carlos","2023-24_2285_2285017_sergio.perez.pelo (Universidad Rey Juan Carlos)"
"PROTECCION DE INFRAESTRUCTURAS CRITICAS","Pérez Peló, Sergio","2023-09-01","2285037-2285","-","Docencia Impartida","Docencia Oficial Nacional","-","-","-","-","-","-","-","Pérez Peló, Sergio (2023). PROTECCION DE INFRAESTRUCTURAS CRITICAS. Universdiad Rey Juan Carlos","2023-24_2285_2285037_sergio.perez.pelo (Universidad Rey Juan Carlos)"
"TECNICAS DE HACKING","Pérez Peló, Sergio","2023-09-01","2285015-2285","-","Docencia Impartida","Docencia Oficial Nacional","-","-","-","-","-","-","-","Pérez Peló, Sergio (2023). TECNICAS DE HACKING. Universdiad Rey Juan Carlos","2023-24_2285_2285015_sergio.perez.pelo (Universidad Rey Juan Carlos)"
"INTRODUCCION A LA CIBERSEGURIDAD","Pérez Peló, Sergio","2023-09-01","2285002-2285","-","Docencia Impartida","Docencia Oficial Nacional","-","-","-","-","-","-","-","Pérez Peló, Sergio (2023). INTRODUCCION A LA CIBERSEGURIDAD. Universdiad Rey Juan Carlos","2023-24_2285_2285002_sergio.perez.pelo (Universidad Rey Juan Carlos)"
"Bases de Datos","Pérez Peló, Sergio","2023-09-01","414704-4147","-","Docencia Impartida","Docencia Oficial Nacional","-","-","-","-","-","-","-","Pérez Peló, Sergio (2023). Bases de Datos. Universdiad Rey Juan Carlos","2023-24_4147_414704_sergio.perez.pelo (Universidad Rey Juan Carlos)"
"UN ENFOQUE METAHEURÍSTICO PARA RESOLVER EL PROBLEMA CLOSE ENOUGH FACILITY PROBLEM","Sánchez-Oro Calvo, Jesús (Cotutor); Pérez Peló, Sergio (Tutor)","2023-07-19","-","-","Dirección de Tesis, TFG, TFM, etc.","TFG","-","-","-","-","-","-","-","Sánchez-Oro Calvo, Jesús (Cotutor); Pérez Peló, Sergio (Tutor) (2023). UN ENFOQUE METAHEURÍSTICO PARA RESOLVER EL PROBLEMA CLOSE ENOUGH FACILITY PROBLEM. Universdiad Rey Juan Carlos","TFG_2285040_ismael.esquilichi_e5bac3610ee40400ec7fc269ee4526db (Universidad Rey Juan Carlos)"
"UN ENFOQUE METAHEURÍSTICO PARA RESOLVER EL PROBLEMA CLOSE ENOUGH FACILITY PROBLEM","Sánchez-Oro Calvo, Jesús (Cotutor); Pérez Peló, Sergio (Tutor)","2023-07-19","-","-","Dirección de Tesis, TFG, TFM, etc.","TFG","-","-","-","-","-","-","-","Sánchez-Oro Calvo, Jesús (Cotutor); Pérez Peló, Sergio (Tutor) (2023). UN ENFOQUE METAHEURÍSTICO PARA RESOLVER EL PROBLEMA CLOSE ENOUGH FACILITY PROBLEM. Universidad Rey Juan Carlos","TFG_2285040_i.gomeze.2019_e5bac3610ee40400ec7fc269ee4526db (Universidad Rey Juan Carlos)"
"GREEDY RANDOMIZED ADAPTIVE SEARCH PROCEDURE PARA EL PROBLEMA DEL SET ORIENTEERING","Sánchez-Oro Calvo, Jesús (Cotutor); Pérez Peló, Sergio (Tutor)","2023-07-14","-","-","Dirección de Tesis, TFG, TFM, etc.","TFG","-","-","-","-","-","-","-","Sánchez-Oro Calvo, Jesús (Cotutor); Pérez Peló, Sergio (Tutor) (2023). GREEDY RANDOMIZED ADAPTIVE SEARCH PROCEDURE PARA EL PROBLEMA DEL SET ORIENTEERING. Universidad Rey Juan Carlos","TFG_2034037_js.tocas.2018_e925d907e9e2782347d09bfb94350f0b (Universidad Rey Juan Carlos)"
"GREEDY RANDOMIZED ADAPTIVE SEARCH PROCEDURE PARA EL PROBLEMA DEL SEPARADOR ALFA","Sánchez-Oro Calvo, Jesús (Cotutor); Pérez Peló, Sergio (Tutor)","2023-07-13","-","-","Dirección de Tesis, TFG, TFM, etc.","TFG","-","-","-","-","-","-","-","Sánchez-Oro Calvo, Jesús (Cotutor); Pérez Peló, Sergio (Tutor) (2023). GREEDY RANDOMIZED ADAPTIVE SEARCH PROCEDURE PARA EL PROBLEMA DEL SEPARADOR ALFA. Universidad Rey Juan Carlos","TFG_2034037_a.ortega.2018_ee8b04bef09e574eeafc0237d7fc2194 (Universidad Rey Juan Carlos)"
"Greedy Randomized Adaptive Search Procedure","Pérez-Peló S; Sánchez-Oro J; Duarte A","2023-01-01","10.1007/978-3-031-38310-6_5","N","Publicaciones","Capítulos de Libro","Control and optimization","Springer Optimization And Its Applications","-","-","-","-","-","Pérez-Peló S; Sánchez-Oro J; Duarte A (2023). Greedy Randomized Adaptive Search Procedure. En . Springer Optimization And Its Applications (pp. 93-105). HEIDELBERG: Springer","2-s2.0-85178325753 (Scopus);W4388740385 (OpenAlex)"
