"TÍTULO","AUTORES","FECHA","INDENTIFICADOR","OPENACCESS","TIPO","TIPO DE PRODUCCIÓN","CATEGORÍAS","FUENTE","IF SJR","CITAS EUROPEPMC","CITAS INSPIRE","CITAS SCHOLAR","Q SJR","CITACIÓN","PIDs"
"Understanding Teachers’ Attitudes and Self-Assessment Towards Computational Thinking","Zapata-Cáceres M; Fanchamps N; Yeter IH; Marcelino P; Martínbarroso E","2022-01-01","10.34641/ctestem.2022.463","Y","Publicaciones","Conferencia Publicada","Computer science applications; Education","International Conference On Computational Thinking Education (Cte 2017)","-","-","-","-","Q4","Zapata-Cáceres M; Fanchamps N; Yeter IH; Marcelino P; Martínbarroso E (2022). Understanding Teachers’ Attitudes and Self-Assessment Towards Computational Thinking. : The Education University of Hong Kong","2-s2.0-85197460240 (Scopus)"
"REPRESENTACIÓN DE ENFERMEDADES MENTALES DESDE EL DISEÑO Y DESARROLLO DE VIDEOJUEGOS","Arias Herrero, Joaquín (Tutor); Zapata Cáceres, María (Cotutor)","2021-10-28","-","-","Dirección de Tesis, TFG, TFM, etc.","TFG","-","-","-","-","-","-","-","Arias Herrero, Joaquín (Tutor); Zapata Cáceres, María (Cotutor) (2021). REPRESENTACIÓN DE ENFERMEDADES MENTALES DESDE EL DISEÑO Y DESARROLLO DE VIDEOJUEGOS. Universidad Rey Juan Carlos","TFG_2321049_a.rodriguezgo.2016_ffa26c03ecb1cbf676dfc5581cbc7db0 (Universidad Rey Juan Carlos)"
"OPTIMIZACIÓN DE MODELOS 3D PARA DISPOSITIVOS MÓVILES","Zapata Cáceres, María (Tutor)","2021-10-26","-","-","Dirección de Tesis, TFG, TFM, etc.","TFG","-","-","-","-","-","-","-","Zapata Cáceres, María (Tutor) (2021). OPTIMIZACIÓN DE MODELOS 3D PARA DISPOSITIVOS MÓVILES. Universidad Rey Juan Carlos","TFG_2265042_s.cruzs.2017_96256c22219f8044c096a052711ac3d4 (Universidad Rey Juan Carlos)"
"Collaborative Game-Based Environment and Assessment Tool for Learning Computational Thinking in Primary School: A Case Study","Zapata-Cáceres, M; Martín-Barroso, E; Román-González, M","2021-10-01","10.1109/TLT.2021.3111108","Y","Publicaciones","Artículo","Arquitetura, urbanismo e design; Ciência da computação; Ciencias sociales; Computer science applications; Computer science, interdisciplinary applications; E-learning; Educação; Educació; Educación; Education; Education & educational research; Engenharias iii; Engenharias iv; Engineering (all); Engineering (miscellaneous); General engineering; Interdisciplinar","Ieee Transactions On Learning Technologies","1.288","-","-","-","Q1","Zapata-Cáceres, M; Martín-Barroso, E; Román-González, M (2021). Collaborative Game-Based Environment and Assessment Tool for Learning Computational Thinking in Primary School: A Case Study. Ieee Transactions On Learning Technologies, 14(5), 576-589. DOI: 10.1109/TLT.2021.3111108","10.1109/tlt.2021.3111108 (Crossref);2-s2.0-85115190239 (Scopus);WOS:000744529600003 (WoS)"
"DISEÑO DIGITAL 3D","Zapata Cáceres, María","2021-09-01","2321018-2321","-","Docencia Impartida","Docencia Oficial Nacional","-","-","-","-","-","-","-","Zapata Cáceres, María (2021). DISEÑO DIGITAL 3D. Universdiad Rey Juan Carlos","2021-22_2321_2321018_maria.zapata (Universidad Rey Juan Carlos)"
"DISEÑO DIGITAL 3D","Zapata Cáceres, María","2021-09-01","2265006-2265","-","Docencia Impartida","Docencia Oficial Nacional","-","-","-","-","-","-","-","Zapata Cáceres, María (2021). DISEÑO DIGITAL 3D. Universdiad Rey Juan Carlos","2021-22_2265_2265006_maria.zapata (Universidad Rey Juan Carlos)"
"Motores de Videojuegos","Zapata Cáceres, María","2021-09-01","634305-6343","-","Docencia Impartida","Docencia Oficial Nacional","-","-","-","-","-","-","-","Zapata Cáceres, María (2021). Motores de Videojuegos. Universdiad Rey Juan Carlos","2021-22_6343_634305_maria.zapata (Universidad Rey Juan Carlos)"
"DISEÑO DIGITAL 3D","Zapata Cáceres, María","2021-09-01","2175006-2175","-","Docencia Impartida","Docencia Oficial Nacional","-","-","-","-","-","-","-","Zapata Cáceres, María (2021). DISEÑO DIGITAL 3D. Universdiad Rey Juan Carlos","2021-22_2175_2175006_maria.zapata (Universidad Rey Juan Carlos)"
"Tecnología de Juegos","Zapata Cáceres, María","2021-09-01","634309-6343","-","Docencia Impartida","Docencia Oficial Nacional","-","-","-","-","-","-","-","Zapata Cáceres, María (2021). Tecnología de Juegos. Universdiad Rey Juan Carlos","2021-22_6343_634309_maria.zapata (Universidad Rey Juan Carlos)"
"ANIMACION 3D","Zapata Cáceres, María","2021-09-01","2265023-2265","-","Docencia Impartida","Docencia Oficial Nacional","-","-","-","-","-","-","-","Zapata Cáceres, María (2021). ANIMACION 3D. Universdiad Rey Juan Carlos","2021-22_2265_2265023_maria.zapata (Universidad Rey Juan Carlos)"
"EDUCACIÓN EN INFORMÁTICA E INFORMÁTICA PARA LA EDUCACIÓN","Zapata Cáceres, María","2021-09-01","630401-6304","-","Docencia Impartida","Docencia Oficial Nacional","-","-","-","-","-","-","-","Zapata Cáceres, María (2021). EDUCACIÓN EN INFORMÁTICA E INFORMÁTICA PARA LA EDUCACIÓN. Universdiad Rey Juan Carlos","2021-22_6304_630401_maria.zapata (Universidad Rey Juan Carlos)"
"EL VIDEOJUEGO COMO MEDIO ARTÍSTICO: EXPLORACIÓN DE ELEMENTOS CLAVE","Rodrigo Miranda, Mercedes (Cotutor); Zapata Cáceres, María (Tutor)","2021-07-17","-","-","Dirección de Tesis, TFG, TFM, etc.","TFG","-","-","-","-","-","-","-","Rodrigo Miranda, Mercedes (Cotutor); Zapata Cáceres, María (Tutor) (2021). EL VIDEOJUEGO COMO MEDIO ARTÍSTICO: EXPLORACIÓN DE ELEMENTOS CLAVE. Universidad Rey Juan Carlos","TFG_2265042_i.nunez.2016_8f1beae25c538c306a447fe1c210df96 (Universidad Rey Juan Carlos)"
"SUDOKUS ADAPTATIVOS PARA EDUCACIÓN INFANTIL O PRIMARIA","Zapata Cáceres, María (Cotutor); Martín Barroso, Estefanía (Tutor)","2021-07-16","-","-","Dirección de Tesis, TFG, TFM, etc.","TFG","-","-","-","-","-","-","-","Zapata Cáceres, María (Cotutor); Martín Barroso, Estefanía (Tutor) (2021). SUDOKUS ADAPTATIVOS PARA EDUCACIÓN INFANTIL O PRIMARIA. Universidad Rey Juan Carlos","TFG_2073058_m.lazaroa_b063cb1064ee995f0196b61884bfde81 (Universidad Rey Juan Carlos)"
"DESARROLLO DE UNA APLICACIÓN WEB PARA FACILITAR LA VISUALIZACIÓN Y ANÁLISIS DE DATOS DE BLUE ANT CODE","Zapata Cáceres, María (Cotutor); Martín Barroso, Estefanía (Tutor)","2021-06-28","-","-","Dirección de Tesis, TFG, TFM, etc.","TFG","-","-","-","-","-","-","-","Zapata Cáceres, María (Cotutor); Martín Barroso, Estefanía (Tutor) (2021). DESARROLLO DE UNA APLICACIÓN WEB PARA FACILITAR LA VISUALIZACIÓN Y ANÁLISIS DE DATOS DE BLUE ANT CODE. Universidad Rey Juan Carlos","TFG_2321050_g.matilla_28bfd4201681f1da5ae8183b19f8a691 (Universidad Rey Juan Carlos)"
"GENERADOR PROCEDIMENTAL DE MAPAS Y BIOMAS PARA VIDEOJUEGOS","Zapata Cáceres, María (Tutor)","2021-06-09","-","-","Dirección de Tesis, TFG, TFM, etc.","TFG","-","-","-","-","-","-","-","Zapata Cáceres, María (Tutor) (2021). GENERADOR PROCEDIMENTAL DE MAPAS Y BIOMAS PARA VIDEOJUEGOS. Universidad Rey Juan Carlos","TFG_2265042_la.munoz.2016_d6b62424ecd783bab4f422bed88c41ac (Universidad Rey Juan Carlos)"
"HERRAMIENTA DE OPTIMIZACIÓN DE RIGGING PARA ESQUELETOS COMPLEJOS","Zapata Cáceres, María (Cotutor); Casas Guix, Dan (Tutor)","2021-06-09","-","-","Dirección de Tesis, TFG, TFM, etc.","TFG","-","-","-","-","-","-","-","Zapata Cáceres, María (Cotutor); Casas Guix, Dan (Tutor) (2021). HERRAMIENTA DE OPTIMIZACIÓN DE RIGGING PARA ESQUELETOS COMPLEJOS. Universidad Rey Juan Carlos","TFG_2265042_ma.saintmard.2016_f212160364a27db8085ce59a7fe2cae5 (Universidad Rey Juan Carlos)"
"TRATAMIENTO DE FICHEROS GENERADOS POR BLUE ANT CODE","Zapata Cáceres, María (Cotutor); Martín Barroso, Estefanía (Tutor)","2021-05-31","-","-","Dirección de Tesis, TFG, TFM, etc.","TFG","-","-","-","-","-","-","-","Zapata Cáceres, María (Cotutor); Martín Barroso, Estefanía (Tutor) (2021). TRATAMIENTO DE FICHEROS GENERADOS POR BLUE ANT CODE. Universidad Rey Juan Carlos","TFG_2118047_l.garciafu_f5952a7171f478414bc57047fe48446d (Universidad Rey Juan Carlos)"
"VIDEOJUEGO BASADO EN CREACIÓN, EDICIÓN Y SUBASTA DE ESTRUCTURAS EN UNREAL ENGINE","Zapata Cáceres, María (Tutor)","2021-05-13","-","-","Dirección de Tesis, TFG, TFM, etc.","TFG","-","-","-","-","-","-","-","Zapata Cáceres, María (Tutor) (2021). VIDEOJUEGO BASADO EN CREACIÓN, EDICIÓN Y SUBASTA DE ESTRUCTURAS EN UNREAL ENGINE. Universidad Rey Juan Carlos","TFG_2175042_d.gonzalezfe_33f4591dfd6daa6ce8aebdc9315f28a7 (Universidad Rey Juan Carlos)"
"BLUEENCODE","Zapata Cáceres, María (Cotutor); Martín Barroso, Estefanía (Tutor)","2021-04-07","-","-","Dirección de Tesis, TFG, TFM, etc.","TFG","-","-","-","-","-","-","-","Zapata Cáceres, María (Cotutor); Martín Barroso, Estefanía (Tutor) (2021). BLUEENCODE. Universidad Rey Juan Carlos","TFG_2059037_ja.plaza.2016_a672fbf8505e8bee7f22b3bba141ab90 (Universidad Rey Juan Carlos)"
"Using the Beginners Computational Thinking Test to Measure Development on Computational Concepts Among Preschoolers","Zapata-Cáceres M; Fanchamps N","2021-01-01","-","Y","Publicaciones","Conferencia Publicada","Computer science applications; Education","International Conference On Computational Thinking Education (Cte 2017)","-","-","-","-","Q4","Zapata-Cáceres M; Fanchamps N (2021). Using the Beginners Computational Thinking Test to Measure Development on Computational Concepts Among Preschoolers. : The Education University of Hong Kong","2-s2.0-85145085546 (Scopus)"
"Universal Structure for guided completion of ICT Engineering Final Degree Projects","Guillen-Garcia J; Zapata-Caceres M; Ortega-Delcampo D; Palacios-Alonso D","2021-01-01","10.1109/ICALTER54105.2021.9675079","N","Publicaciones","Conferencia Publicada","-","Proceedings Of The 2021 Ieee 1st International Conference On Advanced Learning Technologies On Education And Research, Icalter 2021","-","-","-","-","-","Guillen-Garcia J; Zapata-Caceres M; Ortega-Delcampo D; Palacios-Alonso D (2021). Universal Structure for guided completion of ICT Engineering Final Degree Projects. : Institute of Electrical and Electronics Engineers Inc.","10.1109/icalter54105.2021.9675079 (Crossref);2-s2.0-85125353317 (Scopus)"
"Applying Game Learning Analytics to a Voluntary Video Game: Intrinsic Motivation, Persistence, and Rewards in Learning to Program at an Early Age","Zapata-Cáceres, M; Martín-Barroso, E","2021-01-01","10.1109/ACCESS.2021.3110475","Y","Publicaciones","Artículo","Ciência da computação; Computer science (all); Computer science (miscellaneous); Computer science, information systems; Electrical and electronic engineering; Engenharias iii; Engenharias iv; Engineering (all); Engineering (miscellaneous); Engineering, electrical & electronic; General computer science; General engineering; General materials science; Materials science (all); Materials science (miscellaneous); Telecommunications","Ieee Access","0.927","-","-","-","Q1","Zapata-Cáceres, M; Martín-Barroso, E (2021). Applying Game Learning Analytics to a Voluntary Video Game: Intrinsic Motivation, Persistence, and Rewards in Learning to Program at an Early Age. Ieee Access, 9(), 123588-123602. DOI: 10.1109/ACCESS.2021.3110475","10.1109/access.2021.3110475 (Crossref);2-s2.0-85114730089 (Scopus);WOS:000696076200001 (WoS)"
"DISEÑO DIGITAL 3D","Zapata Cáceres, María","2020-09-01","2175006-2175","-","Docencia Impartida","Docencia Oficial Nacional","-","-","-","-","-","-","-","Zapata Cáceres, María (2020). DISEÑO DIGITAL 3D. Universdiad Rey Juan Carlos","2020-21_2175_2175006_maria.zapata (Universidad Rey Juan Carlos)"
"ANIMACIÓN POR COMPUTADOR","Zapata Cáceres, María","2020-09-01","607604-6076","-","Docencia Impartida","Docencia Oficial Nacional","-","-","-","-","-","-","-","Zapata Cáceres, María (2020). ANIMACIÓN POR COMPUTADOR. Universdiad Rey Juan Carlos","2020-21_6076_607604_maria.zapata (Universidad Rey Juan Carlos)"
"TECNOLOGÍA DE JUEGOS","Zapata Cáceres, María","2020-09-01","607608-6076","-","Docencia Impartida","Docencia Oficial Nacional","-","-","-","-","-","-","-","Zapata Cáceres, María (2020). TECNOLOGÍA DE JUEGOS. Universdiad Rey Juan Carlos","2020-21_6076_607608_maria.zapata (Universidad Rey Juan Carlos)"
"DISEÑO DIGITAL 3D","Zapata Cáceres, María","2020-09-01","2321018-2321","-","Docencia Impartida","Docencia Oficial Nacional","-","-","-","-","-","-","-","Zapata Cáceres, María (2020). DISEÑO DIGITAL 3D. Universdiad Rey Juan Carlos","2020-21_2321_2321018_maria.zapata (Universidad Rey Juan Carlos)"
"ANIMACION 3D","Zapata Cáceres, María","2020-09-01","2265023-2265","-","Docencia Impartida","Docencia Oficial Nacional","-","-","-","-","-","-","-","Zapata Cáceres, María (2020). ANIMACION 3D. Universdiad Rey Juan Carlos","2020-21_2265_2265023_maria.zapata (Universidad Rey Juan Carlos)"
"DISEÑO DIGITAL 3D","Zapata Cáceres, María","2020-09-01","2265006-2265","-","Docencia Impartida","Docencia Oficial Nacional","-","-","-","-","-","-","-","Zapata Cáceres, María (2020). DISEÑO DIGITAL 3D. Universdiad Rey Juan Carlos","2020-21_2265_2265006_maria.zapata (Universidad Rey Juan Carlos)"
"Escuela de Pensamiento Computacional","Bacelo Polo, Adrián (Investigador principal (IP)); Zapata Cáceres, María (Investigador principal (IP))","2020-02-12","-","-","Proyectos I+D+I  y Ayudas","Proyecto Competitivo","-","-","-","-","-","-","-","Escuela de Pensamiento Computacional. Bacelo Polo, Adrián (Investigador principal (IP)); Zapata Cáceres, María (Investigador principal (IP)).  Financiadora: AYUNTAMIENTO DE FUENLABRADA  (2020-02-12 / 2022-02-11)","M2222 (Otros);M2222 (Universidad Rey Juan Carlos)"
"Computational Thinking Test for Beginners: Design and Content Validation","Zapata-Cáceres, M; Martín-Barroso, E; Román-González, M","2020-01-01","10.1109/EDUCON45650.2020.9125368","-","Publicaciones","Conferencia Publicada","Education; Engineering (all); Engineering (miscellaneous); Information systems and management","Ieee Global Engineering Education Conference, Educon","0.407","-","-","-","Q1","Zapata-Cáceres, M; Martín-Barroso, E; Román-González, M (2020). Computational Thinking Test for Beginners: Design and Content Validation. Fort Worth (TX, USA): IEEE","2-s2.0-85087905926 (Scopus);WOS:000617739900291 (WoS)"
"CS-TRACK","Rivas Rebaque, Maria Begoña (Investigador/a); Romero Luis, Juan (Investigador/a); Carbonell Alcocer, Alejandro (Investigador/a); Gertrudis Casado, María del Carmen (Investigador/a); Gálvez de la Cuesta, Maria del Carmen (Investigador/a); Gertrudix Barrio, Manuel (Investigador principal (IP)); Zapata Cáceres, María (Investigador/a); Roldán Álvarez, David (Investigador/a); Rajas Fernández, Mario Ignacio (Investigador/a); Martín Barroso, Estefanía (Investigador principal (IP))","2019-12-01","872522","-","Proyectos I+D+I  y Ayudas","Proyecto Competitivo","-","-","-","-","-","-","-","Ref.:872522. CS-TRACK. Rivas Rebaque, Maria Begoña (Investigador/a); Romero Luis, Juan (Investigador/a); Carbonell Alcocer, Alejandro (Investigador/a); Gertrudis Casado, María del Carmen (Investigador/a); Gálvez de la Cuesta, Maria del Carmen (Investigador/a); Gertrudix Barrio, Manuel (Investigador principal (IP)); Zapata Cáceres, María (Investigador/a); Roldán Álvarez, David (Investigador/a); Rajas Fernández, Mario Ignacio (Investigador/a); Martín Barroso, Estefanía (Investigador principal (IP)).  Financiadora: European commision  (2019-12-01 / 2023-01-31)","M2060 (Otros);M2060 (Universidad Rey Juan Carlos)"
"DESARROLLO TEORICO Y PROTOTIPO DE VIDEOJUEGO EN VOXEL ART","Zapata Cáceres, María (Tutor)","2019-10-01","-","-","Dirección de Tesis, TFG, TFM, etc.","TFG","-","-","-","-","-","-","-","Zapata Cáceres, María (Tutor) (2019). DESARROLLO TEORICO Y PROTOTIPO DE VIDEOJUEGO EN VOXEL ART. Universidad Rey Juan Carlos","TFG_2175042_ja.civico_752dcdd2e593a91eead390ad6bf5a6f8 (Universidad Rey Juan Carlos)"
"DISEÑO DIGITAL 3D","Zapata Cáceres, María","2019-09-01","2265006-2265","-","Docencia Impartida","Docencia Oficial Nacional","-","-","-","-","-","-","-","Zapata Cáceres, María (2019). DISEÑO DIGITAL 3D. Universdiad Rey Juan Carlos","2019-20_2265_2265006_maria.zapata (Universidad Rey Juan Carlos)"
"DISEÑO DIGITAL 3D","Zapata Cáceres, María","2019-09-01","2321018-2321","-","Docencia Impartida","Docencia Oficial Nacional","-","-","-","-","-","-","-","Zapata Cáceres, María (2019). DISEÑO DIGITAL 3D. Universdiad Rey Juan Carlos","2019-20_2321_2321018_maria.zapata (Universidad Rey Juan Carlos)"
"DISEÑO DIGITAL 3D","Zapata Cáceres, María","2019-09-01","2175006-2175","-","Docencia Impartida","Docencia Oficial Nacional","-","-","-","-","-","-","-","Zapata Cáceres, María (2019). DISEÑO DIGITAL 3D. Universdiad Rey Juan Carlos","2019-20_2175_2175006_maria.zapata (Universidad Rey Juan Carlos)"
"ANIMACION 3D","Zapata Cáceres, María","2019-09-01","2265023-2265","-","Docencia Impartida","Docencia Oficial Nacional","-","-","-","-","-","-","-","Zapata Cáceres, María (2019). ANIMACION 3D. Universdiad Rey Juan Carlos","2019-20_2265_2265023_maria.zapata (Universidad Rey Juan Carlos)"
"EXPERIENCIA EDUCATIVA PARA EL APRENDIZAJE DEL PENSAMIENTO COMPUTACIONAL EN EL SEGUNDO CICLO DE EDUCACIÓN PRIMARIA","Zapata Cáceres, María (Cotutor); Martín Barroso, Estefanía (Tutor)","2019-07-24","-","-","Dirección de Tesis, TFG, TFM, etc.","TFG","-","-","-","-","-","-","-","Zapata Cáceres, María (Cotutor); Martín Barroso, Estefanía (Tutor) (2019). EXPERIENCIA EDUCATIVA PARA EL APRENDIZAJE DEL PENSAMIENTO COMPUTACIONAL EN EL SEGUNDO CICLO DE EDUCACIÓN PRIMARIA. Universidad Rey Juan Carlos","TFG_2172053_i.fernandezfu_a62a5aca51e6727826f2a182b113a133 (Universidad Rey Juan Carlos)"
"EXPERIENCIA EDUCATIVA PARA EL APRENDIZAJE DEL PENSAMIENTO COMPUTACIONAL EN EL PRIMER CICLO DE EDUCACIÓN PRIMARIA","Zapata Cáceres, María (Cotutor); Martín Barroso, Estefanía (Tutor)","2019-07-04","-","-","Dirección de Tesis, TFG, TFM, etc.","TFG","-","-","-","-","-","-","-","Zapata Cáceres, María (Cotutor); Martín Barroso, Estefanía (Tutor) (2019). EXPERIENCIA EDUCATIVA PARA EL APRENDIZAJE DEL PENSAMIENTO COMPUTACIONAL EN EL PRIMER CICLO DE EDUCACIÓN PRIMARIA. Universidad Rey Juan Carlos","TFG_2172053_e.sancheze_8c66c3a2ea4f5776de1517cd6d495610 (Universidad Rey Juan Carlos)"
"EXPERIENCIA EDUCATIVA PARA EL APRENDIZAJE DEL PENSAMIENTO COMPUTACIONAL EN EL TERCER CICLO DE EDUCACIÓN PRIMARIA","Zapata Cáceres, María (Cotutor); Martín Barroso, Estefanía (Tutor)","2019-07-04","-","-","Dirección de Tesis, TFG, TFM, etc.","TFG","-","-","-","-","-","-","-","Zapata Cáceres, María (Cotutor); Martín Barroso, Estefanía (Tutor) (2019). EXPERIENCIA EDUCATIVA PARA EL APRENDIZAJE DEL PENSAMIENTO COMPUTACIONAL EN EL TERCER CICLO DE EDUCACIÓN PRIMARIA. Universidad Rey Juan Carlos","TFG_2172053_a.gutierrezguti_f86e71358ab718f8851d6a26ccc8a35d (Universidad Rey Juan Carlos)"
"ANIMACIÓN PROMOCIONAL 3D Y MARKETING WEB DE UN VIDEOJUEGO","Zapata Cáceres, María (Tutor)","2019-06-17","-","-","Dirección de Tesis, TFG, TFM, etc.","TFG","-","-","-","-","-","-","-","Zapata Cáceres, María (Tutor) (2019). ANIMACIÓN PROMOCIONAL 3D Y MARKETING WEB DE UN VIDEOJUEGO. Universidad Rey Juan Carlos","TFG_2175042_a.bachillerg_2d1392aed1ecf2ee0e819e3ca920a085 (Universidad Rey Juan Carlos)"
"CREACIÓN DE ARTE PARA VIDEOJUEGO 3D","Zapata Cáceres, María (Tutor)","2019-06-17","-","-","Dirección de Tesis, TFG, TFM, etc.","TFG","-","-","-","-","-","-","-","Zapata Cáceres, María (Tutor) (2019). CREACIÓN DE ARTE PARA VIDEOJUEGO 3D. Universidad Rey Juan Carlos","TFG_2175042_a.sorianov_084de30c46cb2f334a15eee6e128854c (Universidad Rey Juan Carlos)"
"Investigación y desarrollo de tecnologías educativas en la Comunidad de Madrid","Vargas Alba, Ángela (Investigador/a); Sánchez Granados, Ángel Francisco (Investigador/a); Esteban Sánchez, Natalia (Investigador/a); García Iruela, Miguel (Investigador/a); Bacelo Polo, Adrián (Investigador/a); Pizarro Romero, María Celeste (Investigador/a); Lozano Osorio, Isaac (Investigador/a); Santacruz Valencia, Liliana Patricia (Investigador/a); Chushig Muzo, Cristian David (Investigador/a); Cáceres Taladriz, César (Investigador/a); Robles Martínez, Gregorio (Investigador/a); Zapata Cáceres, María (Investigador/a); Pérez Marín, Diana Rosario (Investigador/a); Roldán Álvarez, David (Investigador/a); Gómez Gómez, Marta (Investigador/a); Borrás Gené, Oriol (Investigador/a); González Barahona, Jesús María (Investigador/a); Martín Lope, María Mercedes (Investigador/a); Paredes Barragán, Pedro (Investigador/a); Hijón Neira, Raquel Belén (Investigador/a); Paredes Velasco, Maximiliano (Investigador/a); Palacios Alonso, Daniel (Investigador/a); Martín Barroso, Estefanía (Investigador/a); Urquiza Fuentes, Jaime (Investigador/a); Hernán Losada, Isidoro (Investigador/a); Lázaro Carrascosa, Carlos Alfredo (Investigador/a); Velázquez Iturbide, Jesús Ángel (Investigador principal (IP))","2019-01-01","S2018/TCS-4307","-","Proyectos I+D+I  y Ayudas","Proyecto Competitivo","-","-","-","-","-","-","-","Ref.:S2018/TCS-4307. Investigación y desarrollo de tecnologías educativas en la Comunidad de Madrid. Vargas Alba, Ángela (Investigador/a); Sánchez Granados, Ángel Francisco (Investigador/a); Esteban Sánchez, Natalia (Investigador/a); García Iruela, Miguel (Investigador/a); Bacelo Polo, Adrián (Investigador/a); Pizarro Romero, María Celeste (Investigador/a); Lozano Osorio, Isaac (Investigador/a); Santacruz Valencia, Liliana Patricia (Investigador/a); Chushig Muzo, Cristian David (Investigador/a); Cáceres Taladriz, César (Investigador/a); Robles Martínez, Gregorio (Investigador/a); Zapata Cáceres, María (Investigador/a); Pérez Marín, Diana Rosario (Investigador/a); Roldán Álvarez, David (Investigador/a); Gómez Gómez, Marta (Investigador/a); Borrás Gené, Oriol (Investigador/a); González Barahona, Jesús María (Investigador/a); Martín Lope, María Mercedes (Investigador/a); Paredes Barragán, Pedro (Investigador/a); Hijón Neira, Raquel Belén (Investigador/a); Paredes Velasco, Maximiliano (Investigador/a); Palacios Alonso, Daniel (Investigador/a); Martín Barroso, Estefanía (Investigador/a); Urquiza Fuentes, Jaime (Investigador/a); Hernán Losada, Isidoro (Investigador/a); Lázaro Carrascosa, Carlos Alfredo (Investigador/a); Velázquez Iturbide, Jesús Ángel (Investigador principal (IP)).  Financiadora: Comunidad de Madrid  (2019-01-01 / 2023-04-30)","M1957 (Otros);M1957 (Universidad Rey Juan Carlos)"
"ANIMACION 3D","Zapata Cáceres, María","2018-09-01","2265023-2265","-","Docencia Impartida","Docencia Oficial Nacional","-","-","-","-","-","-","-","Zapata Cáceres, María (2018). ANIMACION 3D. Universdiad Rey Juan Carlos","2018-19_2265_2265023_maria.zapata (Universidad Rey Juan Carlos)"
"DISEÑO DIGITAL 3D","Zapata Cáceres, María","2018-09-01","2321018-2321","-","Docencia Impartida","Docencia Oficial Nacional","-","-","-","-","-","-","-","Zapata Cáceres, María (2018). DISEÑO DIGITAL 3D. Universdiad Rey Juan Carlos","2018-19_2321_2321018_maria.zapata (Universidad Rey Juan Carlos)"
"DISEÑO DIGITAL 3D","Zapata Cáceres, María","2018-09-01","2265006-2265","-","Docencia Impartida","Docencia Oficial Nacional","-","-","-","-","-","-","-","Zapata Cáceres, María (2018). DISEÑO DIGITAL 3D. Universdiad Rey Juan Carlos","2018-19_2265_2265006_maria.zapata (Universidad Rey Juan Carlos)"
"DISEÑO DIGITAL 3D","Zapata Cáceres, María","2018-09-01","2175006-2175","-","Docencia Impartida","Docencia Oficial Nacional","-","-","-","-","-","-","-","Zapata Cáceres, María (2018). DISEÑO DIGITAL 3D. Universdiad Rey Juan Carlos","2018-19_2175_2175006_maria.zapata (Universidad Rey Juan Carlos)"
"PROCESO DE DISEÑO Y DESARROLLO DEL VÍDEO PROMOCIONAL DE UN VIDEOJUEGO PROPIO","Zapata Cáceres, María (Tutor)","2018-07-09","-","-","Dirección de Tesis, TFG, TFM, etc.","TFG","-","-","-","-","-","-","-","Zapata Cáceres, María (Tutor) (2018). PROCESO DE DISEÑO Y DESARROLLO DEL VÍDEO PROMOCIONAL DE UN VIDEOJUEGO PROPIO. Universidad Rey Juan Carlos","TFG_2175042_s.lozoya_cd2cd46165d6d92e6e39967c772e1d3e (Universidad Rey Juan Carlos)"
"ANIMACION 3D","Zapata Cáceres, María","2017-09-01","2321029-2321","-","Docencia Impartida","Docencia Oficial Nacional","-","-","-","-","-","-","-","Zapata Cáceres, María (2017). ANIMACION 3D. Universdiad Rey Juan Carlos","2017-18_2321_2321029_maria.zapata (Universidad Rey Juan Carlos)"
"DISEÑO DIGITAL 3D","Zapata Cáceres, María","2017-09-01","2175006-2175","-","Docencia Impartida","Docencia Oficial Nacional","-","-","-","-","-","-","-","Zapata Cáceres, María (2017). DISEÑO DIGITAL 3D. Universdiad Rey Juan Carlos","2017-18_2175_2175006_maria.zapata (Universidad Rey Juan Carlos)"
"DISEÑO DIGITAL 3D","Zapata Cáceres, María","2017-09-01","2321018-2321","-","Docencia Impartida","Docencia Oficial Nacional","-","-","-","-","-","-","-","Zapata Cáceres, María (2017). DISEÑO DIGITAL 3D. Universdiad Rey Juan Carlos","2017-18_2321_2321018_maria.zapata (Universidad Rey Juan Carlos)"
"ANIMACION 3D","Zapata Cáceres, María","2017-09-01","2175023-2175","-","Docencia Impartida","Docencia Oficial Nacional","-","-","-","-","-","-","-","Zapata Cáceres, María (2017). ANIMACION 3D. Universdiad Rey Juan Carlos","2017-18_2175_2175023_maria.zapata (Universidad Rey Juan Carlos)"
"DISEÑO DIGITAL 2D","Zapata Cáceres, María","2017-09-01","2265001-2265","-","Docencia Impartida","Docencia Oficial Nacional","-","-","-","-","-","-","-","Zapata Cáceres, María (2017). DISEÑO DIGITAL 2D. Universdiad Rey Juan Carlos","2017-18_2265_2265001_maria.zapata (Universidad Rey Juan Carlos)"
"ANIMACION 3D","Zapata Cáceres, María","2016-09-01","2186029-2186","-","Docencia Impartida","Docencia Oficial Nacional","-","-","-","-","-","-","-","Zapata Cáceres, María (2016). ANIMACION 3D. Universdiad Rey Juan Carlos","2016-17_2186_2186029_maria.zapata (Universidad Rey Juan Carlos)"
