"TÍTULO","AUTORES","FECHA","INDENTIFICADOR","OPENACCESS","TIPO","TIPO DE PRODUCCIÓN","CATEGORÍAS","FUENTE","IF SJR","CITAS EUROPEPMC","CITAS INSPIRE","CITAS SCHOLAR","Q SJR","CITACIÓN","PIDs"
"Enhancing computational thinking skills in early education: exploring the efficacy and feasibility of unplugged methodologies","Moreno-Leon, Jesus; Roman-Gonzalez, Marcos; Martin-Barroso, Estefania; Zapata-Caceres, Maria; Jimenez, Marcos; Robles, Gregorio","2025-12-01","10.1016/j.tsc.2025.101879","N","Publicaciones","Artículo","Ciencias sociales; Educació; Educación; Education; Education & educational research; Pedagogical & educational research","Thinking Skills And Creativity","1.410","-","-","-","Q1","Moreno-Leon, Jesus; Roman-Gonzalez, Marcos; Martin-Barroso, Estefania; Zapata-Caceres, Maria; Jimenez, Marcos; Robles, Gregorio (2025). Enhancing computational thinking skills in early education: exploring the efficacy and feasibility of unplugged methodologies. Thinking Skills And Creativity, 58(), 101879-. DOI: 10.1016/j.tsc.2025.101879","10317170 (iMarina);2-s2.0-105007299209 (Scopus);WOS:001506758100001 (WoS)"
"ANIMACION 3D","Zapata Cáceres, María","2025-09-01","2265023-2265","-","Docencia Impartida","Docencia Oficial Nacional","-","-","-","-","-","-","-","Zapata Cáceres, María (2025). ANIMACION 3D. Universdiad Rey Juan Carlos","2025-26_2265_2265023_maria.zapata (Universidad Rey Juan Carlos)"
"EDUCACIÓN EN INFORMÁTICA E INFORMÁTICA PARA LA EDUCACIÓN","Zapata Cáceres, María","2025-09-01","630401-6304","-","Docencia Impartida","Docencia Oficial Nacional","-","-","-","-","-","-","-","Zapata Cáceres, María (2025). EDUCACIÓN EN INFORMÁTICA E INFORMÁTICA PARA LA EDUCACIÓN. Universdiad Rey Juan Carlos","2025-26_6304_630401_maria.zapata (Universidad Rey Juan Carlos)"
"Educación en informática e informática para la educación","Zapata Cáceres, María","2025-09-01","641901-6419","-","Docencia Impartida","Docencia Oficial Nacional","-","-","-","-","-","-","-","Zapata Cáceres, María (2025). Educación en informática e informática para la educación. Universdiad Rey Juan Carlos","2025-26_6419_641901_maria.zapata (Universidad Rey Juan Carlos)"
"DISEÑO DIGITAL 3D","Zapata Cáceres, María","2025-09-01","2265006-2265","-","Docencia Impartida","Docencia Oficial Nacional","-","-","-","-","-","-","-","Zapata Cáceres, María (2025). DISEÑO DIGITAL 3D. Universdiad Rey Juan Carlos","2025-26_2265_2265006_maria.zapata (Universidad Rey Juan Carlos)"
"DIDÁCTICAS DE LA INFORMÁTICA Y TECNOLOGÍA","Zapata Cáceres, María","2025-09-01","638810-6388","-","Docencia Impartida","Docencia Oficial Nacional","-","-","-","-","-","-","-","Zapata Cáceres, María (2025). DIDÁCTICAS DE LA INFORMÁTICA Y TECNOLOGÍA. Universdiad Rey Juan Carlos","2025-26_6388_638810_maria.zapata (Universidad Rey Juan Carlos)"
"DIDÁCTICAS DE LA INFORMÁTICA Y LA TECNOLOGÍA","Zapata Cáceres, María","2025-09-01","618205-6182","-","Docencia Impartida","Docencia Oficial Nacional","-","-","-","-","-","-","-","Zapata Cáceres, María (2025). DIDÁCTICAS DE LA INFORMÁTICA Y LA TECNOLOGÍA. Universdiad Rey Juan Carlos","2025-26_6182_618205_maria.zapata (Universidad Rey Juan Carlos)"
"VIDEOJUEGOS COMO HERRAMIENTA DE APRENDIZAJE EN EL RECONOCIMIENTO DE EMOCIONES E INTELIGENCIA EMOCIONAL","María Arribas, David (Tutor); Zapata Cáceres, María (Cotutor)","2025-07-23","-","-","Dirección de Tesis, TFG, TFM, etc.","TFG","-","-","-","-","-","-","-","María Arribas, David (Tutor); Zapata Cáceres, María (Cotutor) (2025). VIDEOJUEGOS COMO HERRAMIENTA DE APRENDIZAJE EN EL RECONOCIMIENTO DE EMOCIONES E INTELIGENCIA EMOCIONAL.","-"
"DIÁCONOS RECLAMIS: EDUCAR CON RITMO, JUGAR CON LÓGICA","Martín Barroso, Estefanía (Cotutor); Zapata Cáceres, María (Tutor)","2025-07-23","-","-","Dirección de Tesis, TFG, TFM, etc.","TFG","-","-","-","-","-","-","-","Martín Barroso, Estefanía (Cotutor); Zapata Cáceres, María (Tutor) (2025). DIÁCONOS RECLAMIS: EDUCAR CON RITMO, JUGAR CON LÓGICA.","-"
"EL PEQUEÑO GRIMORIO: PROGRAMANDO UN VIDEOJUEGO PARA EVALUAR LA CREATIVIDAD","Zapata Cáceres, María (Tutor)","2025-07-23","-","-","Dirección de Tesis, TFG, TFM, etc.","TFG","-","-","-","-","-","-","-","Zapata Cáceres, María (Tutor) (2025). EL PEQUEÑO GRIMORIO: PROGRAMANDO UN VIDEOJUEGO PARA EVALUAR LA CREATIVIDAD.","-"
"ANÁLISIS SOBRE LA ELABORACIÓN DEL TRÁILER EN VIDEOJUEGOS","Zapata Cáceres, María (Tutor)","2025-07-23","-","-","Dirección de Tesis, TFG, TFM, etc.","TFG","-","-","-","-","-","-","-","Zapata Cáceres, María (Tutor) (2025). ANÁLISIS SOBRE LA ELABORACIÓN DEL TRÁILER EN VIDEOJUEGOS.","-"
"EVIL CORPORATION: DESARROLLO DEL PENSAMIENTO COMPUTACIONAL CON REALIDAD VIRTUAL","Martín Barroso, Estefanía (Cotutor); Zapata Cáceres, María (Tutor)","2025-07-22","-","-","Dirección de Tesis, TFG, TFM, etc.","TFG","-","-","-","-","-","-","-","Martín Barroso, Estefanía (Cotutor); Zapata Cáceres, María (Tutor) (2025). EVIL CORPORATION: DESARROLLO DEL PENSAMIENTO COMPUTACIONAL CON REALIDAD VIRTUAL.","-"
"EL PEQUEÑO GRIMORIO: DISEÑANDO EL ARTE DE UN VIDEOJUEGO PARA EVALUAR LA CREATIVIDAD","Zapata Cáceres, María (Tutor)","2025-07-22","-","-","Dirección de Tesis, TFG, TFM, etc.","TFG","-","-","-","-","-","-","-","Zapata Cáceres, María (Tutor) (2025). EL PEQUEÑO GRIMORIO: DISEÑANDO EL ARTE DE UN VIDEOJUEGO PARA EVALUAR LA CREATIVIDAD.","-"
"WORLDBUILDING: DEL CONCEPT ART AL 3D EN EL DESARROLLO DE UN LIBRO DE ARTE PARA VIDEOJUEGOS","Zapata Cáceres, María (Tutor)","2025-07-19","-","-","Dirección de Tesis, TFG, TFM, etc.","TFG","-","-","-","-","-","-","-","Zapata Cáceres, María (Tutor) (2025). WORLDBUILDING: DEL CONCEPT ART AL 3D EN EL DESARROLLO DE UN LIBRO DE ARTE PARA VIDEOJUEGOS.","-"
"EXPRESSIS: VIDEOJUEGO EDUCATIVO PARA EL APRENDIZAJE EMOCIONAL EN NIÑOS CON ASPERGER Y ALEXITIMIA","Zapata Cáceres, María (Tutor)","2025-07-17","-","-","Dirección de Tesis, TFG, TFM, etc.","TFG","-","-","-","-","-","-","-","Zapata Cáceres, María (Tutor) (2025). EXPRESSIS: VIDEOJUEGO EDUCATIVO PARA EL APRENDIZAJE EMOCIONAL EN NIÑOS CON ASPERGER Y ALEXITIMIA.","-"
"PROPUESTA DE FUSIÓN DE GÉNEROS PARA LOS VIDEOJUEGOS DE LUCHA","Zapata Cáceres, María (Tutor)","2025-07-17","-","-","Dirección de Tesis, TFG, TFM, etc.","TFG","-","-","-","-","-","-","-","Zapata Cáceres, María (Tutor) (2025). PROPUESTA DE FUSIÓN DE GÉNEROS PARA LOS VIDEOJUEGOS DE LUCHA.","-"
"THE WAY BEYOND: GUÍA DE ARTE PARA VIDEOJUEGOS","Villamarín Fernández, Elena (Tutor); Zapata Cáceres, María (Cotutor)","2025-07-16","-","-","Dirección de Tesis, TFG, TFM, etc.","TFG","-","-","-","-","-","-","-","Villamarín Fernández, Elena (Tutor); Zapata Cáceres, María (Cotutor) (2025). THE WAY BEYOND: GUÍA DE ARTE PARA VIDEOJUEGOS.","-"
"VIAJEROS DEL TIEMPO: PROPUESTA PRÁCTICA PARA TRABAJAR EL PENSAMIENTO COMPUTACIONAL A TRAVÉS DE LAS EDADES DE LA HISTORIA EN EDUCACIÓN PRIMARIA","Martín Barroso, Estefanía (Tutor); Zapata Cáceres, María (Cotutor)","2025-07-15","-","-","Dirección de Tesis, TFG, TFM, etc.","DEA, máster, etc.","-","-","-","-","-","-","-","Martín Barroso, Estefanía (Tutor); Zapata Cáceres, María (Cotutor) (2025). VIAJEROS DEL TIEMPO: PROPUESTA PRÁCTICA PARA TRABAJAR EL PENSAMIENTO COMPUTACIONAL A TRAVÉS DE LAS EDADES DE LA HISTORIA EN EDUCACIÓN PRIMARIA.","-"
"TRABAJANDO EL PENSAMIENTO COMPUTACIONAL EN EDUCACIÓN PRIMARIA: LEGO Y OZOBOT","Martín Barroso, Estefanía (Cotutor); Zapata Cáceres, María (Tutor)","2025-07-15","-","-","Dirección de Tesis, TFG, TFM, etc.","DEA, máster, etc.","-","-","-","-","-","-","-","Martín Barroso, Estefanía (Cotutor); Zapata Cáceres, María (Tutor) (2025). TRABAJANDO EL PENSAMIENTO COMPUTACIONAL EN EDUCACIÓN PRIMARIA: LEGO Y OZOBOT.","-"
"EXPERIENCIA PRÁCTICA EN LAS AULAS DE EDUCACIÓN PRIMARIA PARA TRABAJAR HABILIDADES DE PENSAMIENTO COMPUTACIONAL Y CONCEPTOS MATEMÁTICOS MEDIANTE LA PROGRAMACIÓN DE PLACAS","Martín Barroso, Estefanía (Tutor); Zapata Cáceres, María (Cotutor)","2025-07-15","-","-","Dirección de Tesis, TFG, TFM, etc.","DEA, máster, etc.","-","-","-","-","-","-","-","Martín Barroso, Estefanía (Tutor); Zapata Cáceres, María (Cotutor) (2025). EXPERIENCIA PRÁCTICA EN LAS AULAS DE EDUCACIÓN PRIMARIA PARA TRABAJAR HABILIDADES DE PENSAMIENTO COMPUTACIONAL Y CONCEPTOS MATEMÁTICOS MEDIANTE LA PROGRAMACIÓN DE PLACAS.","-"
"AVATARES EN 3D PARA JUEGOS DE SIMULACIÓN EDUCATIVOS","San Martín López, José Javier (Cotutor); Zapata Cáceres, María (Tutor)","2025-06-11","-","-","Dirección de Tesis, TFG, TFM, etc.","TFG","-","-","-","-","-","-","-","San Martín López, José Javier (Cotutor); Zapata Cáceres, María (Tutor) (2025). AVATARES EN 3D PARA JUEGOS DE SIMULACIÓN EDUCATIVOS.","-"
"GAME DESIGN EN VIDEOJUEGOS EDUCATIVOS: SAFELAB","San Martín López, José Javier (Cotutor); Zapata Cáceres, María (Tutor)","2025-06-11","-","-","Dirección de Tesis, TFG, TFM, etc.","TFG","-","-","-","-","-","-","-","San Martín López, José Javier (Cotutor); Zapata Cáceres, María (Tutor) (2025). GAME DESIGN EN VIDEOJUEGOS EDUCATIVOS: SAFELAB.","-"
"DISEÑO Y DESARROLLO DE UN VIDEOJUEGO EDUCATIVO: ENFOQUE TÉCNICO DESDE LA PROGRAMACIÓN COMO CLAVE PARA EL APRENDIZAJE","San Martín López, José Javier (Cotutor); Zapata Cáceres, María (Tutor)","2025-06-09","-","-","Dirección de Tesis, TFG, TFM, etc.","TFG","-","-","-","-","-","-","-","San Martín López, José Javier (Cotutor); Zapata Cáceres, María (Tutor) (2025). DISEÑO Y DESARROLLO DE UN VIDEOJUEGO EDUCATIVO: ENFOQUE TÉCNICO DESDE LA PROGRAMACIÓN COMO CLAVE PARA EL APRENDIZAJE.","-"
"The Competent Computational Thinking Test (cCTt): A Valid, Reliable and Gender-Fair Test for Longitudinal CT Studies in Grades 3-6","El-Hamamsy, Laila; Zapata-Caceres, Maria; Martin-Barroso, Estefania; Mondada, Francesco; Zufferey, Jessica Dehler; Bruno, Barbara; Roman-Gonzalez, Marcos","2025-01-25","10.1007/s10758-024-09777-8","N","Publicaciones","Artículo","Ciencias sociales; Computational theory and mathematics; Computer science applications; Education; Education & educational research; Engineering (miscellaneous); Human-computer interaction; Mathematics (miscellaneous); Theoretical computer science","Technology, Knowledge And Learning","1.210","-","-","-","Q1","El-Hamamsy, Laila; Zapata-Caceres, Maria; Martin-Barroso, Estefania; Mondada, Francesco; Zufferey, Jessica Dehler; Bruno, Barbara; Roman-Gonzalez, Mar (2025). The Competent Computational Thinking Test (cCTt): A Valid, Reliable and Gender-Fair Test for Longitudinal CT Studies in Grades 3-6. Technology, Knowledge And Learning, 30(3), 1607-1661. DOI: 10.1007/s10758-024-09777-8","10303086 (iMarina);2-s2.0-85217434597 (Scopus);WOS:001405514300001 (WoS)"
"Miembro. Programa de doctorado en Ciencias de la Educación y Ciencias del Deporte","Zapata Cáceres, María","2025-01-01","1812871-4920","-","Experiencia profesional","Cargos y actividades desempeñadas anteriores a la actual","-","-","-","-","-","-","-","-","-"
"Miembro. Programa de Doctorado en Tecnologías de la Información y las Comunicaciones","Zapata Cáceres, María","2025-01-01","1813590-4920","-","Experiencia profesional","Cargos y actividades desempeñadas anteriores a la actual","-","-","-","-","-","-","-","-","-"
"Adquisición de equipamiento para Cognición, Robótica, Visión Artificial y Ciencia de Datos: Consorcio de Innovación Digital.","Garre del Olmo, Carlos (Investigador/a); Velasco González, Iván (Investigador/a); Ortega del Campo, David (Investigador/a); Toader, Nicusor Cosmin (Investigador/a); Lancho Martín, María del Carmen (Investigador/a); Gutiérrez Peña, Gema (Investigador/a); Guillén García, Julio (Investigador principal (IP)); Gómez Macías, Cristian (Investigador/a); Zapata Cáceres, María (Investigador/a); Ramos Vega, María Cristina (Investigador/a); Sújar Garrido, Aarón (Investigador/a); Comino Trinidad, Marc (Investigador/a); Pérez Blanco, Francisco Javier (Investigador/a); Aceña Gil, Víctor (Investigador/a); López Cano, Emilio (Investigador/a); Granada Mejía, Juan David (Investigador/a)","2025-01-01","2024/SOLCON-64840","-","Proyectos I+D+I  y Ayudas","Proyecto Competitivo","","-","-","-","-","-","-","Ref.:2024/SOLCON-64840. Adquisición de equipamiento para Cognición, Robótica, Visión Artificial y Ciencia de Datos: Consorcio de Innovación Digital.. Garre del Olmo, Carlos (Investigador/a); Velasco González, Iván (Investigador/a); Ortega del Campo, David (Investigador/a); Toader, Nicusor Cosmin (Investigador/a); Lancho Martín, María del Carmen (Investigador/a); Gutiérrez Peña, Gema (Investigador/a); Guillén García, Julio (Investigador principal (IP)); Gómez Macías, Cristian (Investigador/a); Zapata Cáceres, María (Investigador/a); Ramos Vega, María Cristina (Investigador/a); Sújar Garrido, Aarón (Investigador/a); Comino Trinidad, Marc (Investigador/a); Pérez Blanco, Francisco Javier (Investigador/a); Aceña Gil, Víctor (Investigador/a); López Cano, Emilio (Investigador/a); Granada Mejía, Juan David (Investigador/a).  Financiadora: Universidad Rey Juan Carlos  (2025-01-01 / 2025-12-31)","M3696 (Universidad Rey Juan Carlos)"
"Technological tools for the digital society Education: wellneSs & Health and TEChnology.","García Lorenzo, Marcos José (Investigador/a); Mata Fernández, Susana (Investigador/a); Zapata Cáceres, María (Investigador/a); Sújar Garrido, Aarón (Investigador/a); Bayona Beriso, Sofía (Investigador/a); Robles Sánchez, Óscar David (Investigador/a); Martín Barroso, Estefanía (Investigador/a); Pastor Pérez, Luis Ignacio (Investigador principal (IP))","2025-01-01","2024/SOLCON-137497","-","Proyectos I+D+I  y Ayudas","Proyecto Competitivo","","-","-","-","-","-","-","Ref.:2024/SOLCON-137497. Technological tools for the digital society Education: wellneSs & Health and TEChnology.. García Lorenzo, Marcos José (Investigador/a); Mata Fernández, Susana (Investigador/a); Zapata Cáceres, María (Investigador/a); Sújar Garrido, Aarón (Investigador/a); Bayona Beriso, Sofía (Investigador/a); Robles Sánchez, Óscar David (Investigador/a); Martín Barroso, Estefanía (Investigador/a); Pastor Pérez, Luis Ignacio (Investigador principal (IP)).  Financiadora: Universidad Rey Juan Carlos  (2025-01-01 / 2025-12-31)","M3706 (Universidad Rey Juan Carlos)"
"Computational Concepts and their Assessment in Preschool Students: An Empirical Study","Jiménez, M; Zapata-Cáceres, M; Román-González, M; Robles, G; Moreno-León, J; Martin-Barroso, E","2024-12-01","10.1007/s10956-024-10142-8","Y","Publicaciones","Artículo","Biodiversidade; Ciências biológicas i; Ciencias sociales; Educação; Educació; Educación; Education; Education & educational research; Education, scientific disciplines; Engenharias ii; Engineering (all); Engineering (miscellaneous); Ensino; General engineering; Interdisciplinar; Pedagogical & educational research","Journal Of Science Education And Technology","1.579","-","-","-","Q1","Jiménez, M; Zapata-Cáceres, M; Román-González, M; Robles, G; Moreno-León, J; Martin-Barroso, E (2024). Computational Concepts and their Assessment in Preschool Students: An Empirical Study. Journal Of Science Education And Technology, 33(6), 998-1020. DOI: 10.1007/s10956-024-10142-8","10.1007/s10956-024-10142-8 (Crossref);2-s2.0-85205887116 (Scopus);WOS:001329058300001 (WoS)"
